Comment,IsGreet
服务很好味道不错值得点评,1
好味道不错样式多就是信号不好,1
服务特别好当时和老公过去人也特别多我们运气比较好有位子上菜特别快,1
牛排很好吃基围虾也特别好吃,1
牛排和茶还可以建议披萨什么的做细致点,1
环境还是很好的但是菜并没觉得有多好比如蓝莓绵绵冰感觉就像冰打出来浇上蓝莓浆一样,1
光谷二期的态度好很多一期的服务员有几个态度特别的不好坐了半天喊了几次都没有人搭理这么多年一直很喜欢去你们家的我也不希望看到个别的人把牌子给弄不好了,1
不错哦没有排队而且上菜也挺快的味道很棒我喜欢他们家的厚多士强力推荐厚多士哦而且美团比较划算哦赞一个,1
怎么说呢人太多建议周末不要来但是服务员还是很周到的然后就是没有网美团券都刷不出来最后付的现金好烦都没有优惠芦荟水果沙拉美式碳扒带骨猪扒现磨黑胡椒牛扒意大利长面牛肉酱,1
服务还不错口味吧说实话没有特别满意的感觉,1
原来经常去吃的但是现在发现分量没原来多了价格也一样的涨了两个人吃了快还感觉没吃好,1
味道不错喝环境还好感觉不错,1
菜品很好吃的很舒服下次还和同学一起去服务很好,1
三个人点了一个套餐外加一份牛排一个多士配雪糕和翅中很饱下次还会再来但是这个外加的雪糕也太给力了吧,1
是常客了其实叠加券也便宜不了多少但還是便宜一點味道就那樣,1
味道还好数量有点少环境和服务都不错,0
特别的不错每次都去那边吃感觉挺好的味道也挺不错的,1
吃过很多次了味道很好价格也还行不错,1
在西班牙风情街这边吃的环境和服务都很不错上菜挺快上水也及时服务员很热情服务态度很赞菜品味道也不错唯一美中不足的是没有标明在光谷步行街五楼这边的分店不能使用白走了一趟冤枉路不过总体还是愉快的一次团购还会再光顾的,1
厚多士很好吃牛排只能全熟难吃水果沙拉吃起来都不新鲜啊不过服务态度还蛮热情的哟哈下次还是会去秀玉的环境优雅气质在菜品上应当多创新吸引顾客的味蕾从而增加吃货访问率呀,1
服务态度红烧牛蛙煲仔感觉不热情,0
味道很好去了很多次了去的是光谷的店上次去的是汉街的比上次的多了小菜两个人吃的特别满足不用说了还好今天去的早红烧牛蛙煲仔辣辣的我很喜欢的口味金桔柠檬茶烫烫的一大壶两个人根本喝不完服务也特别周到去的时候没有排队吃完的时候发现楼下排了二十多个人庆幸来得早以后还会再来的希望卖家多多做活动,1
秀玉环境不错下午茶什么的陪朋友聊天心情好得多,1
秀玉的排骨煲仔饭味道一直都很不错环境也挺好的今天去人很少不用排队上菜速度挺快的秀玉一直都吃不腻,1
挺不错的来了好几次了味道还是那样好环境也不错适合约会,1
这一次不管是菜品还是饮料质量都有所下降冰橘茶和水一样淡下次不会去了极品极品反正不会再去了,1
芝士焗西兰花很满意很干净环境也不错水才喝两口服务员就主动加上了都不用按呼叫器态度很好做为外地人去游玩很开心走的时候还有送宾语满分满分建议不知道是不是我没看见桌子上没有牙签,1
桂花物语不错但三文鱼三明治不是很好吃,1
东西都蛮不错的冰橘茶很好喝套餐很划算但是套餐里的意面只有番茄酱的味道推荐选煲仔饭,1
一直在秀玉吃味道还可以环境也挺不错了,1
口味也就那样吧上面有点闷人第一次去感觉一般般,1
挺不错上得比较快服务也比光谷的强,1
周五晚上来的第一次来这家店环境没的说非常好人很多味道的话一般吧因为是团购所以做得感觉一般般下次直接点自己经常吃的再好好评价下这家店的真正水平总体来说还是不错的来光谷肯定来这家店的,1
周一去吃的下面都已经客满了服务员热情的招待我俩上的二楼今天点的是鱼乔煲仔饭个人感觉没有牛蛙煲入味今天候大了点印尼炒饭今天有点腥酷酷虾和黃金牛柳条还是不错的两个人吃的好饱,1
好吃红豆炼乳刨冰很好吃两个人吃了很久没吃完水果沙拉也不错还有蜂蜜厚多士也好吃,1
来过很多次了不多说有机会有时间一定会经常去的,1
一如既往地好和室友一起来吃因为都不饿点的两人餐又点了一份沙拉很饱,1
忘了评价了我弟生日服务员还送了一碗长寿面,1
来过很多次了除了饭点时人比较多需要等之外都挺好的他们家的都挺好吃的,1
环境好服务态度不错上菜很快份量多,1
总体来说还不错味道确实还可以,1
很喜欢一直都很棒秀玉是个老牌子了,1
团购二人餐时间去的刚刚好不用等位,0
一直一直很喜欢秀玉每次男朋友来武汉都要去秀玉吃啊吃以前最爱吃的是厚多士不过现在男朋友很喜欢黑胡椒牛柳意面很推荐嫩牛柳扒真的非常嫩口号很好配上黑胡椒汁简直了啊蒜香鸡中节也是每次必点的很香很香的还会支持秀玉哈哈黑胡椒牛肉炒意粉鸡中节芦荟水果沙拉意面三文鱼排蜂蜜厚多士配雪糕厚多士,1
每次到秀玉总是觉得很舒服各个店的菜都很口味是很不错的地方,1
套餐的东西越来越少越来越不好吃不划算,1
上菜很快服务很不错哦环境比较好,1
非常不错的只是昨天再去怎么没有了,1
味道很好每次错开最高峰去不用排队很好,1
今天四点半到等了半个小时喊了几次才上水五个大人二个孩子花了元味道一般般啦有点赶,1
环境棒上餐速度快餐品味道都非常棒价格优惠里面的帅哥美女服务员的服务都非常热情一后一定常光顾继续保持,1
不怎么好吃是因为是团购的套餐原因么,0
很不错两个人吃感觉多了都吃不完只有不过只有一份牛扒,1
牛排炒饭什么的最爱了味道好环境优雅服务到位用餐更有胃口,1
环境不错服务态度很好说了什么都马上解决了,1
菜品味道还不错就是等的时间稍微有点长,1
无数次来了无论是情侣还是朋友聚餐都很适合味道环境服务都不错,1
水果沙拉的水是越来越多了确实没有以前好那个什么鳗鱼的炒饭味道还行但是淡了一点金桔的那个喝的味道确实还挺不错的前段时间去的空调开的不足有点热,1
环境很好就是今天人有点多说明味道好人才多哈哈这次吃的红烧牛蛙煲仔饭比上次好吃赞赞赞,1
已经是第次去了环境不错双人发到你的套餐跟以前比少了水果沙拉,1
牛排的口感一般没什么特色环境还比较舒适,1
一个人去的由于周一人很少主食上的还挺快的味道还是老味道,1
今天人不是很多周末人比较多秀玉特式的东西豆还不错特别是特式牛扒性价比极高,1
人均消费左右味道还不错那个牛蛙煲仔有点偏辣味道挺好,1
猪扒的鸡蛋要双面煎结果是单面煎底下都糊了整个鸡蛋能吃的就一点了猪扒跟牛扒比起来口味确实是差很多之前每次会吃牛蛙煲这次去牛蛙分量感觉少了很多披萨很难吃冰桔茶除了冰块之外水还没喝一点就没了后来叫服务员在冰桔茶里加了水之前很喜欢去秀玉第一次团两人餐没有觉得很划算感觉很失败下次还是去单点吧,1
环境还不错服务也挺好但主食牛排不好吃饭菜太辣饼也不是很好吃茶的味道怪怪的水果沙拉凑合服务分便利性分食物分环境分总体感觉分,1
吉林你好呢破坏一下破你追名字外婆供过于求银色婆婆需要什么破自行您明明怕老婆郭敬明民乐婆婆小姨我后悔妞岁咯个新订货给你秀姐游戏一民工弟弟哦嘴三文鱼排狗狗回音,1
服务很好菜品蛮多的吃的很开心,1
吃的味道还可以服务还蛮好的,1
好吃不贵超级划算还会再来哦,1
口味很好很好吃棒棒的赞赞赞赞赞上菜速度快服务态度好感觉好好吃红酒也便宜菜很多选择地方多,1
还可以同事介绍的这次也是帮同事买的下次我也试试,1
来了好多次了很多店都可以通用这样非常方便环境也好高峰时间就需要等位不过时间还好,1
牛排味道不错只是一切下去肉就碎了,1
还好四个人套餐才不贵还有一瓶小红酒就是上菜比较慢明明是四份店员以为只有三个一直不给我们上菜除了上菜有点慢其他还好,1
来过很多次了环境不错很舒服,1
牛肉凉拌牛肉意外很好吃环境还不错,1
超级划算不只团过一次了一张一百一张五十两个人可以吃好饱,1
环境真的特别棒而且服务态度也很好盛抹茶蛋糕的盘子有点夸张但味道很对胃口甜而不腻咖啡的感觉一般不过总体上来说是一次不错的体验哈,1
挺好的环境很棒食物也好吃又是牛排又是意面又是披萨才八十多太划算了我们平时去吃都是一百多还有水果沙拉和柠檬茶很满意,1
第二次去了环境非常好服务也很热情连着去了两天份量超级足,1
两个人吃的很饱代金卷很好用,1
没有排队上去就有位子环境可以味道都差不多,1
速度味道环境都挺好的价格不贵显得有档次,1
菜的味道感觉没以前的好吃环境挺不错的,1
还不错吧用券挺划算的,1
一如既往的好呀每次吃好多,1
东西很好吃就是上菜速度有点慢还有现在好多店子都不能用团购了伤心,1
还不错红酒有点难喝不过很划算了四个人团了一个套餐又加了一个披萨和一个厚多士吃的饱饱的总体来说还是满意的啦有机会再去喜欢秀玉的环境下次去喝下午茶棒棒哒,1
店子里的环境很温馨服务员的态度也很好,1
环境很好服务很好吃的不错美食不错,1
还不错口味不错等的也不久而且去的那天还是也没有多收费,1
经常来很不错环境也好,1
很好好习惯服务也很周到位置很多等的时间不长下次还会去的,1
味道还好还是炒饭更好吃水果萨拉不好吃薯条平盘中的鳗鱼太咸了还望改进,1
块的那个冷饮还蛮好喝牛排也还可以就是上餐速度不一样一个人快吃完了另一个人的还没上希望下次能改进,1
服务还行环境还好套餐不错第二次来了,1
雪慕芒果乐很好吃披萨也不错黑椒牛柳炒意粉好吃,1
披萨很好吃茶也很好喝不错,1
挺好吃的就是上菜有一点慢,1
地理位置好很容易找的来了几次了不用排队而且上菜速度很快服务态度不错味道也很好而且环境也很不错,1
好多都没有了是生意太好了吗上菜也慢但催买单很积极味道还行性价比可以希望多一些活动吧加强服务意识毕竟现在同类的餐厅太多了点的蜗牛真是用爬的来啊等到蜗牛上来的桌上却什么餐具都没有这服务真心无语啊,1
已经成了常客服务态度很好可能比较忙上菜有点慢,1
好吃牛排划算虾太油了炒饭还是味道有点淡整体都不错,1
和老姐去吃了还是比较喜欢吃水果披萨其他披萨都不好吃只是觉得秀玉服务态度不是很好让她倒杯水极其不情愿好像我把她怎么了似的秀玉的菜越来越没有以前好吃了还是比较喜欢以前秀玉的味道现在味道差很远,1
还行哦环境挺好的很优雅不过等的有点久但是服务员的服务态度还是不错的,1
还行吧菜品口味可以服务周到环境好就是人比较多服务慢,1
菜品很好牛排合口味环境也好,1
挺好吃的非常喜欢这里的煎饼下次有时间再来,1
还算不错吧买了好几次了能够便宜一点,1
味道还行吧环境还可以以后应该还会去的,1
这次点的是印尼炒饭和牛扒味道都还不错环境安静是用餐首选,1
冰菊茶很好喝意大利面很对我口味,1
第一次来光谷西班牙风情街这边的秀玉环境还可以不过感觉光谷天地那边的相对来说更好味道还是不错的每次人都好多不过这次运气还蛮好没等很久秀玉特色炒饭很好吃里面的材料挺多有虾仁玉米香肠红豆捞好吃就是分量太少了感觉吃不够嘻嘻,1
来了好多次了环境很棒现在冷气来的非常足适合喝茶吃饭的地方位置也比较好找,1
去了很多次秀玉了秀玉厉害的地方是员工的服务先不说其他的单是服务就很让人舒服其次里面的东西经济实惠饮品也很好喝环境也不错就是人多的时候需要等位,1
人很多但是服務態度很好東西很好吃,1
环境口味都很不错很喜欢这种环境,1
很实惠买了两张代金券叠加的两个人吃撑了,1
东西还不错服务也还可以下次再去,1
已经来了好多次了一如既往的喜欢秀玉就是这次去有个男服务员声音超大一时没适应,1
星期天和同学一起去的本以为会等很长时间的上菜的速度超快的口感很好菜的分量也很足服务员的服务态度也很好那个水果茶口味真的不错大大的惊喜很推荐大家去噢下次还去去他们家的美团超划算芝士焗西兰花奶酪披萨黑胡椒牛肉脆豆炒饭三文鱼排,1
牛蛙煲仔饭几乎都是骨头冬菇肉酱意粉酱比较少都没怎么吃橄榄油番茄汁意粉甜甜的还行总体来说还可以啦,1
吃了很多次了除了有一次出现一点小不愉快都很好,1
牛排味道还可以服务差了点叫半天没人搭理,1
口味还可以就是那个人比较多然后吃饭的话服务员比较忙咖喱鸡肉卷饼罗宋汤皮蛋瘦肉粥卡布基蛋糕三文鱼排南瓜奶油汤咖喱牛肉卷黑胡椒牛肉脆豆炒饭皮蛋瘦肉粥罗宋汤咖喱鸡肉卷饼黑胡椒牛肉脆豆炒饭罗宋汤咖喱鸡肉卷饼皮蛋瘦肉粥卡布基蛋糕三文鱼排黑胡椒牛肉脆豆炒饭咖喱鸡肉卷饼罗宋汤皮蛋瘦肉粥卡布基蛋糕三文鱼排南瓜奶油汤咖喱牛肉卷南瓜奶油汤咖喱牛肉卷,1
这一次吃饭是最差的一次点钟进店等了差不多多分钟就轮到我们的号进去后点餐就一直在等待给儿子点了煲仔饭虽然服务员说等的时间会比较长因为想到才吃了点东西就没有在意其他的炒饭小吃意粉都已经吃完单也买过了点钟煲仔饭还没有上期间几次请服务员帮催都说马上来最后一次请经理来亲自到厨房催说是马上炒分钟可以上又等待分钟过后再次请经理给我们解释经理也说不清楚最后考虑到服务员也都挺不容易的就采纳了经理的建议真的让人不可思议不知道厨房在干嘛,1
味道蛮一般的牛蛙饭太辣红酒不敢喝辣口只有炒饭和水果沙拉味道过得去价格很便宜环境也不错,1
位置不太好找上菜速度可能是因为点了牛排所以有点慢不过很好吃赞一个,1
这家小炒肉煲仔味道是我吃了最差的不过菊饭还是不错的,1
还行吧环境还可以不过味道一般,1
秀玉去了好多次感觉挺不错的,1
位置还好就是比较方便其他的没什么,1
很不错跟闺蜜团购去的人很多感觉服务员有点忙不过来,1
还不错但好像没有上一次吃的水果沙拉了,1
经常去秀玉就是遗憾没吃鱼翅捞饭虾挺好吃这次很满意,1
这只奥特曼表达了我此刻的心情手机没电急死了服务员及时借我充电宝心情瞬间豁然开朗很愉快的一次用餐以后会常来,1
还行就是牛排切的我好累筋好多,1
估计是人太多了吧入口的地方一直在拿着话筒喊叫感觉有点吵但是菜都很不错也很够分量就是牛蛙煲仔饭感觉不想以前那么好吃了总体来说还是不错的啊下次有空再来这个套餐吃过好几回了,1
环境还可以但是我们吃的西瓜是坏的就是有点馊了的味道连着两块都是希望对水果这块多看着点毕竟夏天到了吃坏东西容易拉肚子不过总体来说还是不错的,1
这家不用等位但菜的味道有点不如以前特别是牛排其它还好,0
上菜速度很快强烈推荐蒜香翅中每次去必点,1
好有特色环境也非常非常的舒服,1
非常不错就是偶尔排排队其实还好的,1
儿子爱吃味道一如既往好希望经常做优惠券活动,1
户口本来面目知道吗滴滴游戏中心安卓版正式上线了快打开滴滴打车点击左上角个人中心你就能发现游戏中心了其他手机用户不要着急很快你也会加入到滴滴游戏家族中在这个喜大普奔的日子里,1
环境很不错就是咖喱焗饭不太合我的口味红酒蜗牛口味也一般可能今天过节披萨上的实在是太慢买单的时候找零也慢总之今天不是特别满意,1
总的来说是一般般服务员也不是那么热情菜感觉不是很新鲜特别是水果沙拉可能是因为天气热的原因吧,1
味道不错在这吃了很多次了不过服务质量还需提高,1
餐具需要包装不干净不好看厕所太小这么大的店能不能改进下服务很快菜上的时间间隔大了点四个人吃饭花了用了三个优惠券还是比较实惠人很多服务员倒水水不行能不能来点热水,1
还可以吧毕竟是武汉分店多的支持,1
味道挺好的没等分钟就上来了环境也好人均消费也可以,1
性价比很好四人吃很便宜份量还可以,1
环境不错服务也还可以就是东西口味一般性价比不是很高希望越来越好吧,1
还可以秀玉一直是什么都有又相对有性价比的店子上菜速度啊招待客人速度啊都还可以的个人感觉套餐中的煲仔饭做的没诚意作为一个煲仔饭控这个吃起来就此学校食堂的好吃而已而且对于询问能不能收东西这个我不太喜欢,1
味道不错地段也挺好上菜速度也没话说,1
还不错两个人吃的很饱就是饮料没办法带走只能在那里喝光,1
不错多次团了菜品合口味茶很好喝服务也不错,1
秀玉服务就是好感觉好吃好吃喜欢,1
挺好的呢够分量好吃环境服务都很好,1
菜品味道还差一些环境不错希望改进,1
很实惠分量足两个人吃的很饱服务员很细心态度也很好上餐速度很快,1
今天生日店里还送长寿面朋友沒到牛蛙煲仔饭的盖就盖着在很细心呢环境很好因为是下午去的就沒有其他人说的个种排队啦,1
经常来牛排还是秀玉的比较好吃常客了,1
还可以吧就是点了个炒饭等了半个多小时朋友的牛排吃完才上的炒饭,1
挺好的很好吃呦上菜快服务周到四个人全吃完了红酒喝的有点晕哈哈哈哈,1
喜欢光谷二期店的环境好友小聚逛街后不错的选择价格也适中,1
来过几次了之前是去吃的两人套餐这次和朋友过来下午茶感觉还不错,1
突然想吃牛排特地跑去的爽歪歪,1
第二次去了吃的同一款牛排这次肥肉感觉有点多网上团购很划算,1
比较喜欢去西班牙风情街这家茄子煲很好吃,1
觉得没有以前好吃了不过还是不错,1
位置太难找了挺实惠的朋友说一百再去,1
服务周到味道一样总体来说好,1
喜欢秀玉的环境很安逸菜的味道也挺好,1
服务超级棒按铃服务员是跑着过来的足以见服务态度骨牛排味道好棒蜂蜜厚多士配雪糕不要太好吃虽然姐姐说炸一下更好吃但我觉得这样就很好热的面包配冰淇淋呜呜呜吃的停不下来很想抱着外面壳子啃但是好像略丢人鲜虾水果披萨边边我不是很喜欢里面好棒椰果菠萝鲜虾什么的简直了香橙布丁上面略酸下面稍甜真是痛并快乐着布丁奶味不够而且是热的感觉奶味更少了慕斯蛋糕奶茶其实奶茶只有一半一半是泡沫等我想起来喝的时候蛋糕都已经化了奶茶不是很甜我喝着正好总体来说还不错环境也很好,1
还可以就是不错干净卫生了很好的,1
这次吃的不是很好感觉一般希望下次别让我失望期待下次的味道能更好点,0
餐点味道不错环境清幽适合聚餐,1
团购的两人份的东西吃的很撑服务很好赞赞赞赞赞赞赞赞赞赞赞赞赞赞赞赞赞赞赞赞赞赞赞赞,1
一个人吃饭这个感觉怎么都不会觉得好吧看来我觉得你可以在这里您好了一换用户口气质疑难的人员和老外在这里您好看好好看看我不能使用整体素质高中同学录制造者联盟在线等了没说啥呢她说是我不能说我觉得你可以,1
不知道是几次去秀玉了这次去还是点了秀玉特色牛扒味道不错啊就是服务态度服务员的态度很赞就是有一个挂着形象大使一女的态度真的很不好帮忙拿个勺子那态度唉我是请朋友过来吃饭的结果我那朋友被那女的态度给伤了啊难道形象大使只要看脸就行吗去吃饭的看到那种啥形象大使可千万别喊了会影响吃饭的心情的,1
东西比较便宜适合学生党氛围也可以,1
很不错的地方只是上菜可以一齐上就好了,1
两个人吃够够的了冰菊茶好喝点的牛蛙煲好辣牛蛙好碎应该是一只牛蛙现杀所以有点慢披萨很好吃门口叫号的人好吵都快疯了所以感觉吃完走真的好大声哪里是一个西餐厅的感觉没有打满分就是因为太吵了,1
点了两份分量很足吃得好饱味道也不错而且冰桔茶的瓶子好可爱,1
第一次团购去的刚好当天可以用东西好多一家三口去的够吃了服务质量还不错东西没有因团购而打折扣牛排还不错其它的都可以如果套餐里面有个小吃就完美了个人意见环境还可以去的比较早因带了小孩去服务员选了个安静的地方这点很好,1
环境好彩菜品也好服务态度好总体来说很不错呢啊啊啊啊啊啊啊啊啊啊啊啊啊啊啊啊啊啊啊啊啊啊啊啊啊啊啊啊啊啊啊啊啊啊啊啊啊啊啊啊撒淡咖喱海鲜焗饭秀玉特色牛扒,1
还行经常去就是这次把我的菜上别桌了让我等了很久,1
上菜快没排队两个人吃这个套餐足够了最后还剩俩块披萨实在吃不下,1
环境好饭的味道也还不错服务也挺好的,1
一帮同学在此聚会吃的是开心一如既往的满意喜欢秀玉的氛围,1
在风情街那边吃的感觉味道和服务都没光谷的好,1
团购的代金券比较划算点的两份牛排跟牛肉饼跟沙拉口味一般总体还行吧,1
喜欢秀玉又来了哈哈因为不是周末所以人不多服务员态度超级棒牛扒很好吃好大一块意面黑胡椒汁很棒哟牛蛙煲仔真不是一般的辣啊眼泪都出来了各种红尖椒青尖椒泡椒水果好吃茶也好喝刚烤出来的披萨很美味总体满意性价比高很好,1
和哥哥一起去的特别满意两人团购真的很划算牛蛙煲仔要点辣不过合口味真的吃撑了可能生意太好了服务员忙不过来叫服务的时候得叫几次不过理解理解啦,1
不错经常去吃煲仔饭焗饭泰黄炒饭服务员态度很好唯一的缺点就是吃饭太嘈杂了跟中餐厅差不多,1
环境特别好很有情调的一家店特别是阁楼东西也很好吃大赞,1
感觉好慢呀等了半小时才吃上牛排又等了半小时吃上水果沙拉感觉有些水果有些是从罐头里面来的服务态度很好最后一个蜂蜜厚多士很好吃但是吃不下了哈哈愿意再来消费,1
去了好几次了一般都吃西餐味道不错喜欢它的装修环境,1
总体还不错吧那天去人特别的多等了一会儿坐的点了两份牛排两份煲仔七分熟的牛排有一块可能只有四分熟算了这个不说了毕竟总体上还不错他家煲仔送的汤还不错赞一个哈哈超级喜欢,1
不得不说吃了这多次了是不是应该出点新菜了每次都是一样的没创新,1
味道还不错都吃了没有什么浪费的有机会还要来的,1
里面的东西很好吃宝宝生日还送丁一碗长寿面,1
很喜欢秀玉爱他家的煲仔饭仔鸡煲仔饭好吃冰激凌面包也好吃虾球要是再新鲜点就好披萨少部分的款系好吃大部分还是不好吃黑米粥超级好喝猪扒虽然味道好但是吃过一次拉肚子牛排还蛮好吃的没出现过不好反应鳕鱼感觉挺新鲜的总之很爱来他家吃饭值,1
牛排分量很足第一次西餐吃的这么饱披萨不是特别喜欢,1
唉点个羊扒被弄错上了羊腿上来的时候都凉了反正不好吃就那样吧人多得忙不过来,0
很好跟闺蜜两个去吃的两个人吃的饱饱的饮料很好喝环境也蛮好的,1
环境不错安静套餐很实惠只是第一次吃他们家煲仔饭没怎么吃味道一般般,1
非常好服务也很好就是稍微有点慢,1
分量很足两人可以吃饱很喜欢吃牛蛙煲仔就是牛蛙有点少,1
和朋友聚会团一个比单点划算的多三个人吃不玩完,1
真不该六一去抽热闹啊人多伢多吵闹多等位置上菜慢服务员都团团转顾不了,1
耳闻目睹琴房东西瓜葛粉红色运动会,0
环境很棒服务态度好味道也不错总之很满意的就餐,1
自我感觉环境有些压抑也可能是自己当时心情有点差吧不过服务真的是没的说总体来说挺满意的,1
环境还可以口味比较一般团购还是挺划算的,1
绝对五分这是我在美团上第二次给全五分服务态度超好而且菜品味道很正值得推荐,1
东西越来越少味道也不如从前牛排变成猪排了鸡蛋也没问怎么煎直接双面煎,1
不错的吃过很多次了一如既往好,1
除了环境还不错之外都不咋地上菜慢,1
很好很好非常好下次还要去那里吃,1
上菜速度有点慢味道还不错秀玉的口碑一直不错,1
去得时候人很多不过一会儿就候到位了服务很到位,1
环境棒服务态度好下次还会去体验一下下午茶,1
和男朋友一起去吃的点的套餐个人吃的很饱还不错下次在去,1
环境还是非常好的味道也还可以,1
希望多出点那种三至四人套餐的团购活动,1
