Comment,IsGreet
个人吃加了个羊腿不错的一家西餐厅还会光顾,1
我和男朋友是秀玉的老顾客了第一次认识就是在秀玉吃的饭他们家的环境优雅菜品味道也挺不错今天和男朋友再次来到秀玉服务员王小凤接待的我们服务态度非常好值得推荐小吃鸡翅经典西冷甜点金桔柠檬茶红烧牛蛙煲仔,1
每次来秀玉觉得心情很好因为环境不错东西又很好吃因为没有拍照的习惯只能拿朋友做的东西来凑了貌似我太懒了最喜欢和朋友来一起吃个饭聊天很惬意很放松下次来试试下午茶应该也会不错的,1
和室友一起来的这里位置很好找整个装饰也很有格调适合人们休息点了香辣咖喱鸡焗饭冰淇淋水果圣代奶油培根意面牛肉汉堡水果沙拉焗饭味道不错芝士咖喱份量足水果圣代选的是树莓和香草味的冰淇淋这两个味道都很好吃整体上来说这次吃的很开心,1
还不错吧环境优雅菜品种类多味道还可以,1
不好吃都浪费了真不知道秀玉现在怎么这么差了,0
味道还不错环境比较好就餐很安静,1
环境特别好牛排也特别美味金桔茶特别推荐哦就餐特别推荐,1
还可以人不多上菜快服务好,1
带着弟弟们来吃的位置有点难得找人很多味道不错看来地方不同秀玉的味道差别也大,1
邓平小姐姐服务态度很好因为是第一次来这里耐心给我们推荐菜品回答我们的问题这里二楼比较安静喜欢高高的房顶强烈推荐这家第一次来没有失望吃的特别饱下次还回来,1
味道好吃可以可以男朋友吃的很满意,1
环境还不错主要是吃这个衣服上不会有味道饮料也很好喝不是那种用粉冲出来的服务员态度也都很好给我们服务的王小凤应该没打错名字服务很周到点赞,1
味道不错套餐实惠小孩很喜欢吃,1
味道好很喜欢吃推荐,1
炒饭和牛肉饼还不错,1
晚上去的牛排全熟盘子都是温的沙拉也不好吃感觉都是放久了的点了个面包汤真难喝差评,0
邓平小姐姐的服务很好小姐姐很有活力哈哈祝该店生意红火服务超赞,1
服务员汪思佳态度不错店里环境好冷气足,1
味道很好敖之放,1
很好余梦月,1
服务员余梦月服务态度非常好五星好评,1
牛排要七分给做全熟味道差服务员服务不周到,0
邓平服务很好,1
套餐里的牛柳一点都不好吃面是硬的,0
味道不错经常来吃也会介绍朋友过来的,1
口味环境服务等位,1
印尼炒饭有一点点小辣但是越吃越来劲奶油意面特别好吃我很爱吃这些腻腻的食物奶油味道很浓吃完了想把剩下的奶油都刮干净还点了一份牛肉春卷吧忘记叫什么名字了外面很脆里面的肉被煮的特别香很多地方都有这个门店特别推荐印尼炒饭脆炸牛肉条奶油意面,1
菜品一菜服务差地很二年前去吃味道好服务地很好现在完全不行了在也不会去了,0
美团购买优惠不错口味一如既往的可以上菜稍微慢了一点,1
各方面都不错,1
强烈推荐环境优美适合闲聊,1
人性化体贴,1
很好,1
每次最爱和朋友一起来的秀玉吃完饭聊天很舒服,1
菜品的分量少了点环境还可以的,1
菜品味道都很不错尤其是香蕉松饼特别美味香蕉上的一层焦糖皮子很好吃酥脆可口松饼也很香甜软糯上菜速度也快十多分钟点的五个菜品就都上齐了店员的服务态度也非常友好环境那就更没得说一直很喜欢秀玉的装饰风格特别温馨的感觉,1
环境不错个别服务人员服务态度不耐烦望改进,1
味道不错就是价格有点贵打折时还是比较划算的,1
服务态度很好菜品上的很快非常满意,1
味道很棒服务员王小凤服务非常棒,1
味道一般可能是我去的有点多了,0
菜品味道不错环境还行但是服务员的态度有待改进煲仔饭需要一个小时以上但是点单的时候没有人提醒后来催的时候另外一个服务员很冲说是已经说过了你自己选择的结果等了一个小时煲仔饭还不怎么好吃,1
王晓凤服务态度很好菜品味道不错,1
环境还不错菜真是不好吃点的菜都没吃完都浪费再也不去了,0
在美团上订的的套餐一大桌两个人吃不完那么多牛排配的烤土豆炒鸡好吃牛肉卷也好吃味道很赞服务员服务非常好,1
和好朋友一起很开心味道不错环境幽静适合小聚,1
还不错一直都是常客很喜欢里面的牛排很嫩口感不错,1
吐槽一下服务生这杯套餐饮料只可以选冰金桔或西瓜汁我们都不喝冰不能换别的饮料情有可原但是冰金桔不能去冰块是为什么呢服务员硬说不能去冰块那好我们自己捞捞出了三杯子冰块再加点热水才能喝去冰的小事都不能满足顾客要求匪夷所思,1
环境优美服务好价格合适特别是餐品吃的人心里舒服饿着肚子来饱着肚子走上餐也很快,1
味道可以环境不错,1
之前的体验都很愉快都给了好评今天不太好不想给好评了,0
服务员都很热情周到就是牛排太难吃了多的牛排又柴又酸失望失望,0
小炒回锅牛肉煲仔湘腊肥肠跟饭湘味小炒牛腩牛腩煲仔饭,1
王小凤阿姨说话温和服务热情衣着整洁时不时的会帮忙看下餐品有没上齐阿姨人蛮好的下次还过来吃饭,1
感觉不怎样评分还这么高是有假吗,0
跟同学一起去吃的感觉的还不错不仅可以吃到中餐还可以吃到西餐味道超赞,1
点多进店可能因为周六吧人多服务员忙不过来菜品上的慢牛排上来都有点冷了体验不是很好,0
口味不错服务不错位置好找,1
不错挺好的常去的一家店子,1
很久没有去秀玉了感觉生意没有原来好了可能是竞争太激烈了吧食客口味在变商家也要跟着改变,1
不错,1
还可以吧环境相对来说是很舒适的,1
环境优雅味道还行啊上菜速度已可以,1
真心难吃一点都不正宗分熟的牛排给我烤的里面还有血无语,0
我们坐在角落来了半天都没人理我们,0
服务很好环境也不错饭菜也很可口泰式咖喱牛肉卷东京式咖喱猪排饭柠檬水碳烤澳洲牛小排,1
两个人吃的份量还挺足的牛排味道不错的其余的就一般般了,0
王小凤服务热情逛街累了看到她的笑容感觉很舒服,1
经常光顾男票喜欢吃他家的煲仔饭,1
王小凤餐员服务员非常好满分分餐品也很棒味道好份量足给您满分好评,1
王小凤服务员很不错餐品很棒经常来的店,1
环境很不错装修内饰很舒服适合工作日晚上家庭活动,1
口味还行环境优美服务到位等位上菜快,1
态度不好说餐桌上的漏斗计时送小吃没用了没用摆在那儿干啥服务员愣死,0
还可以的环境好味道好消费平价,1
服务不错菜价亲民环境优雅不错的西餐厅,1
小炒肉煲仔饭还不错为什么一定要字以上呢,1
还可以吧就是沙拉太差了就只有生菜牛肉条也没就一个春卷一样的东西很难吃估计以后不会去秀玉了,0
味道还可以服务口味没毛病环境还可以,1
服务热情份量足环境优雅菜品不错,1
还行不错味道还行可以的,1
点的三样菜品全部踩雷番茄牛腩跟饭上来是凉的而且酱汁很难吃,0
主要是环境好习惯了在秀玉里吃饭,1
环境不错左右的牛排做的不怎么样,1
汉堡划算又好吃环境特别高大上新会员还有送小食,1
口味不错服务很好,1
味道一般环境好服务员态度好,0
环境很好曹燕的服务态度很好以后会经常光顾,1
头一次在光谷秀玉红茶坊吃饭环境非常简约大气很有宜家的风格里面有一个服务员王小凤姐姐人非常友好服务很贴心在这里给五星好评菜品价格性价比非常高尤其是披萨简直良心价了金桔柠檬茶既美观又好喝强烈推荐总之是很的一次用餐个赞,1
菜品都很好吃蜂蜜厚多士堪称经典性价比高难得的好店,1
每次到光谷来都是在他们家吃饭菜品份量充足上菜比较快服务员随叫即到推荐服务员席梓强很热情,1
经常在秀玉家吃饭味道都还不错每次必点牛排但这家确实份量少勉强给个好评吧,1
突然有两三个月没吃你们家东西昨天带同事去吃了一下巨难吃点了三份秀玉精选牛排那个服务员下单的时候连鸡蛋是单面煎还是双面煎都给我们下错了拿上来的时候鸡蛋都是冷的最后说一下服务员都没问我们配什么酱就直接全部给我们上了黑椒酱服务一般菜也是越做越难吃了不想说什么希望店家改进吧,0
味道一如既往好李冬洋服务很好满意,1
菜品挺不错的环境很舒服服务员也比较热情强烈推荐,1
蛮好吃就是老是忘了刀叉味道不错爱吃芝士饭,1
服务态度有待提高菜品一般没有什么吸引的,0
味道不错服务员也特别热情有一位姓马的服务员特别好用餐很愉快,1
钟志服务非常好下次还会再来,1
沙拉不错哦,1
菜品不错王小凤服务的很好,1
煲仔饭有点多牛柳排还不错肉眼牛排一般,1
黄维君耐心热情,1
服务员很热情菜的味道也蛮好下次有机会会再来的,1
曹燕的服务挺好的环境也挺喜欢,1
黄维君小姐姐服务很好态度很亲和,1
好评去了很多次,1
还不错吧人挺多的和闺蜜一起去的,1
上菜速度特快环境挺好的就是服务员业务水平有待提升,0
服务环境口味詹红服务周到很赞时令水果色拉蒜香鸡中节,1
服务员黄维君的服务态度很好很幽默这家店不错以后会常来的,1
黄伟君态度友好服务周到,1
服务周到牛排味道不错感谢服务员徐龙的热情周到服务,1
黄维君服务态度好,1
服务热情环境温暖小孩喜欢,1
服务员不熟练味道还可以环境一般般,0
王小凤女士服务非常好很满意,1
饭很好吃茶也很好喝上菜很快,1
钟志服务态度很下次再来,1
陈黎,1
钟志服务很好下次再来,1
吴梦蝶棒棒哒,1
口味环境环境好,1
味道很满意,1
秀玉已经去了好多次了味道还不错,1
王小凤服务态度很好分量足好吃,1
服务还不错东西不怎么好吃披萨真的好难吃牛柳刚吃还可以越吃越腻,0
感觉份量比较少而且要美团付款的时候服务员是个女的那表情像吃了苍蝇一样恶心你们店铺自己做活动折付款又不是求着你们有必要说不清楚能不能用然后语气态度都不好做不起活动就别搞来吃饭又不是来看你脸色的还挺年轻的服务员怎么表情像要死了一样呢,0
水果沙拉还可以的雪球面包也可以服务态度一般般啦习惯性五星,1
服务员王小凤态度可以很热情菜品的话还行比较合胃口,1
菜式很新颖看着就有胃口环境也好五分好评,1
味道一般吧番茄牛肉饭饭量很少,0
王小凤服务很好牛排味道不错,1
不错,1
儿子喜欢吃他家牛排只能妥协希望牛肉更新鲜一些,1
服务态度不好明明点的牛柳意面换成米饭重点是换成米饭你给我加一个米饭几个意思呢你是需要我说三遍请你告诉我啊不带这样自作主张的吧以后去你秀玉吃饭是不是该你决定我吃啥不核对菜单就买单差评,0
牛排味道还可以环境优雅服务好,1
味道不错真好吃环境和服务超级赞,1
还不错好吃也不怎么辣下次还来,1
环境很好,1
每次跟儿子二个人来吃都要点差不多的东西儿子喜欢吃这里的牛排,1
坑死了没有牛排是汉堡肉沫,1
没有以前做的好了很多都做假了,0
不错味道好服务好分量足,1
就那样呗反正经常去买单的时候折时候服务员像是不愿意让人用样的,1
三个人吃两份牛排都吃完了鸡排还没有上单子上的时间和上菜的时间隔了分钟加上之前等的时候也有半个小时多了主要又不是节日还是五点多去的,0
一直在他们家吃吃了几年了,1
和男票一起去的吃的只是一个安静的环境菜品味道一般般价格不高性价比还算高,1
的我在一期消费的点到你们这边的买单了还不给我退款说我消费了我消费的腿的,0
每次点去皮的牛蛙偏偏给我上有皮的牛蛙牛扒也是黑乎乎的土豆全部烤焦了越来越差越来越难吃对于老顾客真的是很失望,0
牛排七分熟朋友有点吃不惯,1
不错,1
一边正在装修有些气味味道还可以吧,1
服务不周到我已经提醒好几次了上菜还是过了分钟,0
手上有个汉购通的购物卡汉购通的宣传资料上说可以去秀玉消费到了后发现合作取消了只能付现金,1
服务员王小凤热情周到好评,1
还行吧只是觉得服务不太及时环境不错食品精美却没留下深刻的印象,1
味道还不错每次回武汉只要时间允许总会去吃一回本人不喜欢吃披萨鸡中节咖喱鸡肉卷饼三文鱼排牛蛙煲鳕鱼条,1
环境还是不错的哦菜品口感也不错的哦比较满意的还是适合情侣约会吧那环境好哈哈哈哈性价比也还是不错的哦可以去试试,1
都跟正常环境清雅适合情侣朋友约会,1
秀玉老牌店了价格实惠性价比高,1
鸡中节满分好评骨牛排很有嚼劲,1
服务态度差我们是来吃饭的不是来看服务员脸色的这么不耐烦别做服务行业啊职业素养都没有,0
差的很再也不来了标榜着延时免单呵呵就一句对不起,0
棒棒哒,1
味道好环境也不错,1
感觉还不错位置也比较好找上菜也不需要等很久环境还算只是忘记拍照了下次有机会多拍照,1
牛排都没问我们要几分熟就上上来了,1
味道棒棒哒,1
很好吃环境好,1
一般般都不好吃不伦不类服务也不好,0
牛排烤老了份量没以前多了,1
收银态度不行面无表情态度差,1
就是优惠太少了,1
很喜欢这里的环境真的很不错的,1
一如既往的好希望秀玉能一直坚持下去以后还会去,1
一楼服务台态度一般其他都超棒,1
餐品上上来一点食欲都没有服务员还比较能赊很皮,0
挺好吃的团购很便宜服务一般,1
味道还是可以的团购还是很划算的,1
还行吧环境和服务都很好就是感觉味道蛮一般的感觉好像都是现成儿的加热一下就端上来了的其他的还可以,1
经济实惠个人吃了一桌子问道也可以,1
菜都上了餐具没到菜吃完了饭还没来等了一个多小时催了好几次了最后告诉我单子搞漏了加急做了个煲仔饭搞成了锅巴饭还糊了一大片,0
牛肋排做的全熟烤焦了全国应该就此一家服务员一本正经的说只能做全熟,0
上菜快跟汉口这边的菜单不一样没有吃到我想吃的,1
味道不错分量也够三个人吃撑了,1
服务不行口味可以等位不用等环境可以,1
环境现在不咋的虫子飞来飞去的,0
还可以味道不错还需改进,1
除了上餐的服务较好整体服务员有待培训提高素养吃了这么多年秀玉唯一一次不好的体验,0
非常适合约会的地方环境很好也很好吃和我好朋友还有她男朋友一起来的这个地方很给面子分量好多我还点了份牛排我们三个人都没有吃完下次还会来的给秀玉点赞,1
吃饭聊天的好去处多次来这家,1
吧台男吧员买单的态度太差,0
味道还不错啊分量也还可意,1
一般不好不坏不知道吃什么可以去,0
很便宜很实惠一份牛排可以吃饱,1
汤是真难喝,1
味道真的垃圾可以说没有味道,0
都是肥肉,0
东西越做越差劲煲仔饭根本不是现做的,1
很多次了味道还是那个味道,1
菜品还不错服务比较热情整体感觉不错,1
很好很好很好非常好推荐这家去吧,1
很好很好很好非常好推荐这家去吧,1
套餐还行可能是太久没来秀玉感觉没以前好了鸡肉卷饼是真的不好吃啊,1
服务比较差,0
一直都是秀玉的忠实粉丝味道一级棒服务也是一级棒希望秀玉越来越好,1
味道挺好的分量也足几个同学以前还在里面工作过食材安全卫生,1
嗯好的,1
从点餐到买单我想问贵店的服务员小姐姐们我欠你们钱了吗我是去吃饭不是去看你们脸色的吧,0
氛围还不错食物味道一般,1
没有打包袋只有打包盒呵呵,0
一如一如既往啊既往啊爱吃,1
披萨不咋地不好吃,0
跟我最爱的人一起的怀恋,1
不错经常来吃,1
无服务员上餐员态度不好菜品不咋样,0
总体很满意就是吃不太习惯其他都好吃环境也不错逛街累了歇脚吃饭的好地方,1
还不错买的套餐觉得很划算可以去尝试,1
还是可以的希望能再多推出几款相应的套餐,1
上菜很快服务好但是有的不是很好吃,1
很不错啊,1
不错,1
很好吃年和女朋友去吃的那个时候还是学生没有什么钱感觉很值现在已经分手了这年多我再也没有找过对象孤独必定使人强大今天无意中看到这个单又让我想起当年那段快乐的时光感谢秀玉,1
玉米汁很好,1
很好,1
还可以孩子比较喜欢每次要吃他们家牛排,1
服务好环境舒适适合带家人和朋友最喜欢柠檬茶,1
服务稀烂,0
还可以吧服务态度挺好的,1
还不错后面带老妈和弟弟去的那叫不能美团披萨不咋滴其他还行,1
東西不錯價格實惠環境優美經常喜歡去適合家人朋友去環境舒適,1
还可以,1
吃的挺好团购很划算,1
很好,1
还是不错的喜欢吃他们家的煲仔饭每次去都必点很好吃专门去吃西餐的地方吃中餐哈哈,1
食物还是不错服务态度没有以前的好,1
环境一般味道还可以服务态度一般,1
金桔柠檬茶不错,1
非常差感受特别糟糕根本服务点单喊了半天想着周末吃完就赶紧回去就在一个穿白色衬衫的女生的帮助下用美团买了单还没有到门口就有一小伙问有没有买单告知了已买过但是到了一楼又有人问有没有买单瞬间就无语了这沟通这服务怪不得有一天听到你们的员工在讨论现在的秀玉和以前没法比了此刻同感,0
气氛适合聊天服务一流上菜有素付款便捷二楼开放了环境也是相当不错下次有机会还来这里,1
吃了一万次了比较适合休息聊天哈哈哈哈哈,1
不错,1
挺好吃的下次还去服务员很好,1
菜品真的很差发现秀玉现在除了煲仔饭还能下口以外其余的不是一个难吃能形容的我能说我一颗星都不想给的么,0
饮品不咋样吃的还可以喝的是真的不推荐了,1
很好,1
超级难吃这是最后一次去秀玉的形象瞬间崩塌,0
不满意,0
特别划算也很好吃,1
简直完美很不错的吃饭体验服务一级棒,1
钟爱秀玉,1
人叫一个多东西一般化坐坐休息一下还可以,1
美团点的二人套餐分量足味道也特别好就是中午人多猪扒味道不错煲仔饭做的超级好啊意面倒是一般般女生吃是完全没问题的等的时间比较久秀玉的环境不错没那么吵闹带宝宝来果然是正确的啊睡得熟呵呵呵,1
吃过很多次了相对还是比较满意的,1
比以前差多了鸡蛋蛋清都没熟纸巾也没有不会再来了,0
本来是回头客但是这次的服务不怎么样,1
秀玉这两年可以倒闭的感觉前面的服务也越来越差厨房的出品也不行,0
还可以就是水果沙拉不新鲜有待改进上菜稍慢,1
羊排很不错水果披沙好一般服务态度还行服务质量不高,1
味道很赞棒棒哒,1
挺好的比较满意下次还会再来的,1
发现全都涨价啦空调就跟没开一样热死,1
喜欢布丁,1
很不错分量十足还会再去的划算,1
牛排真的超大份一本满足,1
非常好的一次用餐菜品不错分量足值得再去,1
我不是个喜欢吃西餐的每次都是想吃吃到嘴边就想说再见秀玉却很赞吃完了主食一定还有第二次猪扒咖喱牛肉卷金菊柠檬茶,1
很喜欢秀玉去了好几次了菜品好味道赞还会再去的,1
一如既往的好每次必去的地方喜欢它的风格和环境,1
人不多上菜快,1
秀玉不错挺好的,1
我的心一直悬着一样可以理解的士费,1
秀玉是我经常去的餐厅服务好味道好,1
味道不怎么样服务态度不好以后再也不去了,0
味道一般态度不好不会再来了,0
第一次吃西餐一个人吃着个人的餐要求服务员上份餐具那天吃的很难过但菜口感还不错服务员态度很好好评可惜也许再也不会来这家餐厅了,1
环境非常好口味也不错,1
不知道说什么有些不愉快但是也解决了,1
秀玉吃了好多次了还是很不错的,1
经常去吃,1
挺好的两人餐吃得很饱喝的甜品也都有味道也不错挺满意的,1
一如既往地好吃性价比也很高套餐内容丰富两个人吃到撑,1
灰常好吃服务很周到热情不错的体验,1
还可以,1
就是秀玉的味道希望多推出新品新品的宣传折页不要做的像黑暗料理,1
吃了很多次了还蛮好的环境也不错味道也蛮好值得去,1
菜品不错服务周到价格实惠值得拥有,1
咖啡淡得出奇芝士蛋糕好评其他一般,1
非常棒要是吃披萨能给个手套就好了,1
环境跟所有的秀玉差不多服务不错上菜速度按规定分内味道也还不错休闲聊天不错的地方逛街累了去这里补充能量吃饱之后可以又继续逛了泰皇炒饭的米好像有点硬了牛排还行吧薯条不算好吃好油好油其他的也都还行吧,1
第一次去那个店二楼高逼格,1
环境挺好的服务态度很满意,1
东西还行吧味道也就那个样子吧,1
感觉一般吧牛排不是很好吃,1
味道不行服务态度差上菜速度慢,1
很好朋友聚餐都很喜欢,1
想吃牛排推荐的牛排真心不好吃那个慢烤的其他的还不错,1
番茄牛腩跟饭那米饭硬的像子弹还有番茄牛腩太酸了,0
味道还行肉酱意粉有点腻人可能最近都不会在想吃了分量还是可以的上菜很快,1
味道不好环境不错只能说环境不错,1
挺好吃的也挺实惠的,1
就这样吧,1
海鲜炒饭最好吃服务也很好主要是干净卫生,1
跟老公一起去的还可以味道还行吧地段蛮好,1
老顾客了应该不知道吃什么这个一直是首选,1
还不错两个人吃很饱环境也不错,1
服务很好,1
一般吧胜在量多吃多了会腻服务员听到是美团感觉态度就一般般了,1
还可以哦味道好,1
东西难吃是关键服务一般般唉,0
不错,1
孩子去吃的感觉还行吧,1
感觉还不错不错性价比比较高,1
不错点了多次,1
很好就是点的茶有点酸服务挺好味道也可以,1
真的不错确实很好大家快来吧好吃好玩,1
吃喝都很一般就是带小孩在哪里休息一下不错,1
环境好吃的马马虎虎,1
意大利面条竟然用热干面的面条代替金桔柚子茶变成话梅柚子茶好无语,1
服务很好吃的很愉快,1
人不多的时候还可以炒饭味道不如从前了尤其是泰皇炒饭,1
还不错最近去的少太忙了有空还会去的,1
三个人吃加了一份煲仔饭奶昔不好喝茶上得慢快吃完了才上其他都可以,1
菜还不错吃的牛排就是黑椒汁太少了,1
就那样吧服务一般菜也一般总而言之非常一般,1
味道越来越差一大半没吃,0
永远忘记不了的两个人,1
聚会首选秀玉品牌美味可口,1
服务较慢但环境不错,1
很不错的西餐厅秀玉算的上是最平价的西餐厅吧虽然平价但是服务和菜品一样是非常不错的环境优雅不闹人非常适合一个下午茶的地方,1
有机会再去的不过优惠没怎么增加啊,1
回头客了喜欢里面环境就是菜单上老是那些好吃的基本都吃过了,1
等台和停车不太满意停车小时真是不够吃饭小时都不一定够还没算等台时间再逛逛超市每次都超时停车还收的特别贵超市和商圈的配套停车竟然收元一小时如果不是停车不满意会去的更多些,1
贵阳召开了你们的话我们就算你是一,0
真的很好吃啦便宜干净味道还很棒吃的团购餐两个人吃很饱很饱有主食小吃甜点还有饮品团购餐真是贴心呢服务态度也是棒棒哒环境很优雅反正我吃西餐不喜欢太吵闹的环境觉得秀玉的整体还是很不错的推荐各位亲,1
分量挺足的两个人吃够了秀玉的环境和服务一直都很好,1
味道还行一直去吃习惯好评吧,1
还行味道一般般环境一般服务还行,1
位置在光谷步行街上下两层就餐区很大有专用电梯非常方便门口迎宾点餐服务都很热情没有因为是团购就区别对待上餐很快牛排炒饭小食都很新鲜味道很赞饮料一壶非常实惠够个人共同畅饮我给好评哦,1
味道还可以价格适中没太多惊喜的感觉,1
味道不错,1
感觉还好就是有点小贵,1
个人一不小心吃了,1
煲仔饭超好吃牛排一搬,1
牛排好吃环境非常棒喜欢适合约会的情侣们,1
秀玉算是大家比较常去的一家店了中西餐都有任君选择大爱蒜香考翅中水果茶等副食价格不贵,1
秀玉的团购套餐很实惠家庭聚餐就买了二份吃的很饱牛扒口感不错炒饭除了卖相略差口感还是很不错滴饮料都是冰饮在这个季节不是太适应建议可以替换些暖饮不得不说饮料口感也是相当不错服务态度很好值得赞一个,1
不错,1
还不错喜欢到秀玉来吃,1
有机会会继续光顾的,1
有机会会继续光顾的,1
想不出来吃什么的时候去就秀玉反正我是超喜欢的便宜服务好吃的味道也不错每次都吃咖喱鸡肉焗饭真是吃不腻泰皇炒饭牛柳条水果沙拉蜂蜜厚多士鸡扒都喜欢,1
也没服务员接待大冷天团购的套餐建议增加热饮,1
一如既往的支持就是感觉牛排有点老黑椒汁有点辣其他还好希望以后优惠能多一点,1
一般总那个到地方去了不错吃什么了就他们家吃排骨饭,1
