Comment,IsGreet
环境可以菜的味道也不错服务态度好,1
芒果冰淇淋蛋糕很不错厚多士也不错他们家的餐具很精致喜欢他们家的杯子,1
服务还蛮好感觉今天吃的味道没以前的好环境比光谷步行街的要好些,1
非常好菜也很好吃吃的好饱不错的地方,1
很不错的约会环境餐厅设计风格独到空间开敞大气团购份量很足也很美味以后应该会常去,1
环境很好味道也特别好百吃不厌,1
味道还行人还挺多的,1
量很多两个人吃到撑结果披萨还打包回去环境也特别好,1
很不错两个人分量很足吃的很开心最重要是那个柚子梅子茶真的是超级超级好喝,1
牛肉太肥有的还嚼不烂其它还好,1
两个人觉得蛮划得来,1
挺好的美团很方便很实惠秀玉的口碑还不错,1
环境很好牛扒的味道还不错团购还蛮划算以后还会选择秀玉希望店越办越好是个不错的好地方,1
很值得的团购团过很多次了味道还是一样的好支持,1
喜欢那里的环境服务也不错的,1
可能是天气太冷了点的鸡中节和牛排端上来的时候都冷了,1
很好,1
吃了很多次了很满意很好吃,1
很好,1
太划算了两个人绝对够吃味道不错美团真是一个神奇的网站,1
一如既往的赞来了很多次了不管服务还是口味推荐炒饭,1
蛮划算的觉得黑椒牛排还是那么好吃,1
秀玉的味道我们一直比较喜欢有美团的团购比较划算活动能大点就好了,1
超级好吃真的很不错啦希望这样的团购多有哈哈,1
还是一如既往的不错老婆很喜欢牛蛙煲还有貌似披萨换了一种不是原来那张了,1
还是跟以前一样的好经常和朋友一起去以后还会光顾的,1
还行吧煲仔饭胡了而且辣椒太辣,1
味道很好看到一大桌美食瞬间心情美爆了环境和服务也都挺好的,1
挺不错的位置比较好环境还是很好的,1
挺不错的位置比较好环境还是很好的,1
挺不错的位置比较好环境还是很好的,1
整体还是很好的用了好几次这个套餐了两个人可以吃到撑,1
大爱光谷天地最好吃虽然现在排队久也免不了喜爱,1
今天去了没人理吃个东西餐具什么都缺冰桔茶还是蛮好喝但是没给杯子我们像自助的在二楼吃的,1
上菜太慢等了好久才给菜单上了菜餐具都不给呼叫买单服务员迟迟才来总之这次相当不满意,1
不错不错错就是牛排煎的鸡蛋不怎么好还有洋葱给的太多了,1
套餐很划算如果有几个可以选择的就好了,1
菜的口味依旧是那么好牛排很嫩以后吃牛排就锁定秀玉了,1
经常去他们家吃味道很不错环境也很喜欢以后还会经常光顾的,1
不得不说味道很好吃周末人比较多感觉有点吵哈有就是入口是那个小楼梯口显得不上档次刚开始还以为那个不是入口额,1
环境很好已经去过两次了感觉味道很好服务也很好,1
还好吧,1
量足味道好服务也不错赞一个第次去了,1
味道很不错环境也相当好服务态度就更不用说了十分满意带外地朋友吃饭第一个地方就去那,1
划算每次都吃到撑,1
和男朋友来吃感觉挺好的吃过太多次了也没什么特别的感觉了,1
去过很多次了环境很好服务也好最喜欢牛腩煲仔饭和秀玉特色炒饭牛排也好吃,1
环境可以牛蛙饭太辣牛排某些部位比较老,1
味道不错服务周到服务的妹子很可爱,1
去拉很多秀玉店子在光谷二期有种被冷落的感觉感觉还是黄石二店最温馨最热情大家可以去体验一下以后去秀玉除了黄石二店就不去拉,0
已经吃过很多次了真的很不错服务也很不错推荐牛蛙煲仔饭真的很好吃,1
牛蛙煲仔饭还不错最爱秀玉的牛扒和水果沙拉冰饮也还不错但是披萨从来没吃完过真心不喜欢也许个人口味吧但是秀玉的环境什么的也是没话说人多时要等这次吃的也蛮开森,1
觉得非常划算吃的东西也不错我喜欢,1
图凑杀戮塔吉克族,1
一般吧人很少的时候上菜也很慢额,1
还不错吧,1
差进店就说二楼有位子然后自己去到二楼有个穿白衣服的说后面有位子自己就走到后面一看都是大桌子最后找了半天终于找到个两人位子坐下我坐下十几分钟没有人给我上水也没有点单难道都这么忙我在她们面前都看到后来还是一位男士询问我是几位给我拿了点单按说光谷的服务态度比其他店好啊我昨天完全没看到差差差想到就无语,0
服务态度好不会因为是团购而怠慢并且还向我们推荐用哪个更实惠环境高端大气上档次而且东西也好吃大爱,1
很喜欢吃冬菇肉酱意粉价格也很便宜和朋友打算下次一起去吃下午茶有时候人多的时候用不了,1
还可以呢就是服务员动作太慢了喊半天就在你旁边晃都不过来还有水都不给上,1
不错很划算两个人点了牛扒煲仔饭千层面披萨吃撑了,1
氛围不错适合情侣味道也不错,1
真的很实惠,1
不知道是不是周末人多牛排上错了上餐时间太长服务态度一般,0
第二次团购这个套餐了和第一次一样的满意性价比很高环境好奥去的早的话上菜也很快这次服务的小伙子很热情服务超满意,1
味道不错两个大人加上孩子吃的很饱赞个,1
一如既往的好,1
不错味道很好下次再来,1
还可以一直大爱秀玉,1
去吃的时候人好多生意火爆环境好味道好服务态度更好帅哥好多,1
朋友托我团的她和男朋友去吃的看到了她发的朋友圈大赞呀看起来很丰盛有机会一定回去试一试,1
非常满意吃的很舒服特别是披萨是不是做披萨的师傅换了比以前去秀玉吃的披萨好吃多了女儿说和必胜客的披萨一样好吃,1
口味很好很实惠吃得很开心,1
已经是多次去秀玉了味道确实不错服务也比较满意环境感觉很适合吃吃饭顺便小聊一会这次觉得自己吃的特别开心难道是因为和特别的人么有机会一定要带爸妈过来,1
牛扒不错茶也很好喝多次光顾了,1
环境很好口味也不错在光谷天地服务态度很好然后在光谷步行街也团了个套餐结果上来的炒意粉上的饼干上居然有像蚊子脚一样的黑东西喊服务员来看她说喊另外的一位年纪大一点的过来居然看了之后轻描淡写的说不是蚊子而是手上不小心弄上去的脏东西并且果断的用手擦去我那个去有这样讲话的么我吃的东西就算不是蚊子脚有脏东西也是正常的么把心情搞坏了再后来来了位貌似领班的说给我补偿打折问题是这种服务态度这种语气还会去吗打折拒绝带孩子离开意粉没动这是我网购以来第一次给这么低的评价,1
味道一般那个柠檬茶略坑从团购角度来讲还划算,1
最喜欢里面的饭饭了好香很好吃,1
很不错三个人去吃点了这个套餐好点了个焗饭分量不错味道也还可以下次还会再过来的,1
环境蛮好的上菜也很快服务态度也是极好的,1
味道很好总体来说很不错就是一开始去找了很久才找到哈哈后来走到西班牙风情二楼硬是没找到上去的路,1
喜欢他家的小鸡仔煲仔特别棒,1
西冷牛扒很好吃环境不错,1
环境很好套餐里的东西味道也都很好只不过服务一般开始去的时候坐那半天叫了两次都没人理上牛排的时候都不给一块布挡着胡椒汁差点溅一裤子,1
服务很好个人吃很划算,1
分量很足口味不错食材新鲜两个人根本吃不完生意很好人多还排了一会队很满意的一次团购,1
总体不错番茄茄汁意面口感很好牛排太老嚼不动牛排里的意面硬了些其他都很不错,1
还可以经常去的以后还会继续光临滴哟,1
在秀玉吃过几次了这边环境很不错服务员很有素质食物也很好特别喜欢那个煲仔饭下次还会再来的,1
不错不错好吃环境也好就是周末人太多,1
煲仔饭味道偏辣饮品的冰太多了现在天气转凉实在喝得有点发冷二个人吃太多披萨吃不了打包了团购很划算,1
上餐很快服务态度不错价格低合理,1
装修风格很口味上怕辣的同学要注意牛蛙煲仔恐怕你们不住以上,1
很好捏味道比汉口的好喜欢重口味实惠,1
团购还是划算多了便宜一块也是好的赚钱不易啊,1
团购人套餐挺划算美女帅哥服务很热情,0
还是很不错的已经团购了很多次继续,1
下午去的人比较少点了牛排和披萨等比较喜欢吃披萨,1
吃了两次店里的牛扒很好吃环境很好,1
吃了两次店里的牛扒很好吃环境很好,1
挺好的就是这次来人有点多满意,1
很久没去现在份量变少了一般,1
环境不错味道也人还是很多的不过也没等多久,1
好,1
不错不错,1
吃了一半才想起了拍照个人吃太多了个人应该足够牛排的蛋煎得太差了,1
环境不错服务也不错关键是不用等位又能吃到美味真心好下次再来,1
已经来过秀玉好几次了确实环境很好但就是帮我们点餐的服务员说话的声音太小了一点也听不见而且面无表情有点影响心情不过我和朋友吃得很饱味道还不错,1
非常好每次光临都很开心,1
还不错以后有机会可能还会和朋友一起去,1
真心不错态度很赞带宝宝去的很不方便但是服务员都很热情帮了不少忙,1
价格合理环境舒适味道独特服务周到你值得拥有,1
感觉牛排很好吃很喜欢黑胡椒的味道黑胡椒牛肉炒意粉也很不错就是主食点太多了吃的好撑但是好开心下次要尝尝甜点,1
环境不错味道也还行就是人略多感觉有点忙不过来一直忘了给我们上茶总体来说很不错,1
还不错哦,1
哈可以不错就是煲仔饭太辣了有点受不了,1
非常不错的套餐足够两人吃会常去,1
实惠环境好食欲卫生做的很好的同时味道也不错,1
很好就是周末不能用这个只能买代金券要是周末能用就了,1
口味一级棒完全星环境也好,1
口味一级棒完全星环境也好,1
还不错吧就是有的菜太慢朋友吃完了我的还等半个小时才上,1
好吃嘛吃嘛嘛香的哈哈哈环境不错一直爱去,1
很不错哈就是上菜速度慢朋友的牛扒都吃完了我的才来囧不过好吃服务态度也好下次还来嘿嘿,1
菜都很不错牛排很好吃环境也挺好滴很舒服下次要来尝尝炒饭看着很好吃滴样子哦,1
吃了两次喜欢听秀玉的音乐整体不错,1
服务员问了我四遍要不要收盘子我看到周围有空位觉得她是找茬狠心的拒绝了她后来走的时候发现好多客人在排队等吃饭才恍然大悟特不好意思了,1
份量很足两个人吃得很饱物超所值哦,1
环境不错可能是挺忙的都没人怎么理我们意面味道一般般牛排肉质很嫩喝的东西还不让不加冰块又冰又酸披萨还挺好吃的总得来说没多值单点来吃价位也差不了太远,1
总体还好啦西班牙风情街店就是电梯有点难找明明看到在三楼就是不知道怎么上去可能自己很少来黑胡椒牛肉炒意粉有点干其他还挺满意的,1
环境还不错味道蛮喜欢的就是因为人比较多最后的冰淇淋上得有点慢了,1
挺好的抢的代金券两个人用了两张点了四种很饱,1
很好呢和朋友一起去吃的吃的很满足服务员的服务也很好吃的很开心打算有空再去吃这个,1
第二次来了环境挺不错的适合逛街累了坐下来聊聊天吃吃饭挺有情调,1
购买了多次了非常划算两个人吃得很饱,1
味道还行团购很划算值得去,1
不错呀服务挺不错的披萨牛排意面我觉得都还算不错,1
很不错服务也好在光谷店吃的也蛮喜欢的会经常去,1
服务还不错吃得也挺好愉快度过周末,1
特别棒特价抢购的很实惠牛排也很好吃沙拉也不错服务周到周围逛街也很方便强力推荐,1
我经常去噢就是觉得美团还不错觉得比较经济实惠一般吃饭就选这,1
男服务生态度很好两大人加一个五岁小伢共消费元用张券正好,1
一般般,1
最喜欢的还是秀玉特色炒饭哈哈水果茶也好喝哦,1
还可以开发票,1
之前就去过好几次的挺不错的团购很划算的,1
两个人吃刚刚好就是人有点多等了挺长时间的菜色还可以,1
用餐非常愉快服务员非常到位味道也很好性价比很高,1
之前就去过好几次的挺不错的团购很划算的,1
和朋友一起一起去的感觉很不错,1
味道还是不错的份量不是很足啊够了吗,1
热饮很好喝但牛扒和牛蛙煲仔饭有一丢丢辣水果沙拉很好吃下次会再来的,1
口味挺不错的服务十分棒十分有耐心环境十分优雅在周末的时候也比较好特别喜欢这里的环境十分有感觉两个人吃十分划得来有披萨牛扒冰桔茶特别棒下次还来味道一等一的棒,1
还好去的时候有点忙总是忘上水,1
味道不错下次还会去,1
牛扒不错环境还好女朋友很喜欢,1
好好的东西吃很多次了态度非常好东西很不错噢下次在来,1
好好的东西吃很多次了态度非常好东西很不错噢下次在来,1
味道还可以就是服务态度不怎么样,1
菜很好吃人好多服务也很周到环境也很好等了一会儿去过很多次了很好赞,1
不错很实惠服务蛮周到就是地方难找了一些,1
环境好份量足两个人吃的很饱服务态度也好,1
真的还不错哦我都去过好多次啦以后还回去的,1
真的超赞啊第一次团购秀玉真是赞爆了各种丰富不说味道很赞牛排超嫩披萨不错牛蛙骨头多了点冰橘汁很赞的唯一不足的没有广埠屯那家安静不知道是不是晚上人多的原因总之全五星啦,1
秀玉的东西不用多说了大家都知道这次美团非常成功希望以后也可以有这样的活动,1
嗯超级无敌棒绝对超赞的一次消费这是第一次美团没想到这么划算秀玉红茶坊真是太棒了而且服务也超赞呵呵以后还会光临希望秀玉红茶坊越来越棒,1
味道还不错位置也还方便服务要加强总体还行,1
不错不错价格实惠煲仔饭不错茶也好喝以后多去,1
很不错带家人一起去的很划算,1
非常不错环境好味道也非常不错朋友们都很喜欢以后聚会可以常去,1
一如既往的好在黄石就一直很喜欢秀玉环境也好两个人吃分量很足,1
很好很棒味道不错以后还会再来的,1
服务态度很好饭菜很好吃下次还去,1
位置有点难找人很多需要等位子味道分量都可以还不错,1
第三次去拉服务很好环境也不错真心赞下次有机会还会去,1
挺划算的吃的很开心分量很足都没吃完下次还会来的,1
一般般吧觉得有点贵了成本也要不了多少钱啊,1
经常去的位置大众口味还可以主要是住的近方便朋友小聚还行谈不上多有特色环境不错服务也不错,1
很划算家里六人一起很开心,1
菜不错感觉一个人吃会方便一些,1
牛蛙煲仔很好吃牛扒也很不错两个人吃的很撑,1
还不错的跟两三个朋友一起去聚聚的感觉还不错选择这样的地方心情也会有所增添,1
味道一般环境不错,1
来了很多次了孩子喜欢吃牛排这次点了羊排味道感觉更好呢,1
不好吃服务不及时除了环境好点没啥优点还很热,0
不错,1
西班牙风情街那家秀玉还不错味道不错环境也不错,1
秀玉是一如既往的好每次来都喜欢焗饭以前总点培根芝士焗饭觉得这款芝士超多咸度适中这次试了下香茅牛肉焗饭也好好吃哦牛肉超多的双人餐很划算三份主食绝对吃到撑我们还喜欢双球的蜂蜜厚多士吃过几家了还是秀玉的最好吃,1
味道还行服务态度也好就是我等了一个小时,1
还不错厚多士好吃不过我喜欢舔味淡一点的,1
服务小哥很有趣食物美美的常来,1
牛扒味道不错服务很好环境也不错很喜欢金橘柠檬茶就是对这里不熟找了好久才找到这家店,1
价格公道味道还行有机会再来,1
环境还不错我觉得味道还不错煲仔饭味道特别好有点辣,1
虽然觉得秀玉有点贵可还是忍不住诱惑蛋糕是每次必点的,1
好带老婆孩子一起没吃完环境好,1
虽然大门不好找但是服务还是相当不错的里面的员工都好帅好漂亮上水的时候女友随口说了句要热水不能喝冰的服务员很细心的把冰饮换成了热饮太感动了,1
环境很好蜂蜜厚多士很好吃牛蛙煲仔饭很辣够味道饮品一般代金卷还是很优惠的,1
很好环境不错而且东西很好吃,1
口味很不错价格也不贵环境很好,1
秀玉环境还是一直比较不错的服务员服务也算可以比起其他家的来说,1
代金券很划算期待下一次活动,1
很大一桌东西味道还行喜欢这个冻桔茶把所有东西吃光后觉得都撑了在西班牙风情街这边人不会太多感觉比在光谷步行街那边的餐厅安静一些以后会考虑再来,1
水果芦荟沙拉全是西瓜和哈密瓜分量完全是不能忍,1
八点才去的秀玉也许是饿了感觉今天的特别美味等的时间也不长服务态度也好很满意下次还去风情街这家,1
牛蛙堡仔饭很辣不过我女友很喜欢吃五分哦,1
第一次团购没注意是团的哪家结果去了歩行街的那家然后店员告诉我了一个错误地址绕了好多地方才找到这家店的服务员都很不错态度和服务都非常好赞一个牛排很嫰儿子很喜欢就是鸡蛋煎糊了然后挖了一块饮品也好喝饭和披萨也不错,1
真的不错而且美团很划算味道也不错分量也足下次再来,1
不管如何秀玉的团购都很划算套餐可以直接优惠不够的单点还可以买现金优惠卷非常实惠哈哈三个人团购再点一个主食就足够了以后还会来吃这都是第三次了,1
点多去的没有等位离开的时候门口已经开始排队服务很好看我带了娃给了个很宽敞的位置套餐品种丰富味道不错,1
服务稍微差了点不过总体来说还不错,1
味道可以就是水果不新鲜煲仔饭烧糊了,1
服务很好东西也很好吃分量很足娃保很好啊牛排也不错披萨也好金桔茶好喝,1
环境很好的味道也不错经常来了团购也划算不了太多,1
人太多呼叫器是坏的该换了上菜太慢我太饿东西都吃完了,1
这个套餐真的很值好吃不贵而且环境很好比其他秀玉都好,1
口感好特别划算两个人迟到撑建议亲们可以去尝尝,1
常客一直不错,1
和小伙伴一起去的点了一个盖浇饭是我有史以来吃的最热的一次环境氛围都很不错,1
环境很好菜品比较多样还是可以值得一去,1
挺好的光线太暗菜品有问题也看不到,1
那次去的人比较多点单都等了好久不过菜的味道还是不错的,1
服务很好环境也很好两人真的吃的好饱,1
不错挺划算的两个人吃的很饱一如既往的好,1
披萨口感味道真不怎么样其他的还好服务员叫次也不搭理搭理了也跟面瘫一样不过环境还行,1
环境不错套餐搭配很棒商家生意很好我们吃得很开心,1
现在才看到和妹妹一起去的她说还蛮好的,1
已经去过很多次了最喜欢秀玉的环境了这次吃的水果沙拉里面还加了芦荟口感很不错,1
秀玉的牛排全吃遍了这次点的确实不怎么样就是图片上那个然后以前的柠檬水好好喝现在变淡了环境好总体可以,1
环境很舒服就是牛扒有点硬饮品好喝总体不错,1
总体还不错环境挺好的两人套餐挺便宜的,1
不错上菜速度蛮快就是意粉搞胡了点老公蛮喜欢滴,1
不错环境蛮好的味道也可以,1
味道不错比较有特色装修效果也很好下次还会再来,1
很好吃很实惠就是由于人太多所以水果没沙拉了,1
不错不错这是第二次去了男朋友生日去的态度很好,1
真的很好吃服务员超级贴心披萨很好吃下次还会去,1
按铃后十多分钟才有服务员来点餐意面颜色奇怪还嚼不动披萨像没蒸干的馒头茶太淡颜色也浑浊说出来都是泪本来还团了张代金券的回来赶紧退了,1
很实惠的套餐个人都够吃去的时候过了午餐高峰上餐很快一直很喜欢秀玉希望越做越好,1
我们去的时候人很多但我们等了差不多多分钟就到了上菜的速度也很快吃的分量很足两个人吃的很饱服务员的态度也不错但味道一般,1
感觉秀玉环境一直不错很舒服氛围也很温馨特别适合和闺密一起聊聊天吃吃东西这次去楼感觉秀玉有失水准啊牛排要的分熟结果上来都是全熟的了而且牛排很难嚼感觉里面有筋反正不是特别好吃蜂蜜厚多士还是不错挺好吃的,1
可以,1
口味一般菜色搭配不错环境优雅联系多一点主食的选择,1
环境很舒适干净服务很热情牛蛙很够味牛排很嫩下次还会再来还有茶很好喝,1
来了很多次的店没有以前感觉好了半天服务员不搭理茶水也没人上点的东西上东西也慢份量也做少了发展要保证质量啊光多开分店也要服务质量保证啊,1
菜的味道很好服务很到位不错,1
好满意啊和好朋友一起吃了一顿记忆难忘,1
环境很赞服务很赞位置很赞味道很赞速度很赞价格很赞都很喜欢,1
牛蛙煲仔饭没有别的店好吃牛排很嫩服务很好,1
环境不错哦服务态度不错啊菜太慢了味道一般吧没有以前好吃唯一的鸡翅好吃全部吃完了,1
味道不错额第三次过来了,1
很好东西很多都吃不完说是二人餐其实三个人吃都可以的噢,1
周末去的人太多了三个大人三个小孩等了半个小时才有位置天气凉了套餐里的冰橘茶换成热的柠檬柚子茶就好了,1
味道一般服务不想说了不好,0
还不错环境好服务态度好价格还一般,1
番茄汁意粉有点硬酱有点少没有上次吃的好吃其它都挺好的服务也很好,1
很好啊味道不错都喜欢以后还会再来希望有更多优惠出更多种类的团购券饭很好下次想吃意大利面,1
环境好味道好服务也可以,1
中午吃完饭就睡着了醒来发现身上有件毛毯感觉好温馨啊服务太好了以后还会再去,1
经常去吃这次一共去了七个人在光谷二期店西班牙风情街三楼那家服务员很好本来说给我们个包间不过看了一下包间太小了只能坐六个人又换到了个大地方点菜的时候都是牛排但熟的又不一样把服务员都搞晕了不过都是专业的一下就记好了口味都不错也不是第一次了就是双人套餐和这个代金卷不能一起用还是双人的划得来不过都要吃牛排也只能用这个了一共买了张还不错,1
黑椒牛扒相当不错朋友很喜欢环境也好,1
东西还可以环境好态度好总之就那样都不错不好找上楼的地方,1
带闺密去的味道很赞服务也无可挑剔当然了还有好听的音乐越来越喜欢秀玉啦,1
服务蛮好的也很贴心去的时候是爆满的还是从后门进去的但服务很周到也很贴心很满意,1
环境很不错很干净分量也很足个人完全够了,1
挺好吃的分量很足就是沙拉酱有点少额哈哈,1
很好已经是第三次来了服务员都比较热情,1
还不错,1
无论是在家乡还是在武汉吃饭都会忍不住去秀玉无论是哪方面它都不错,1
很实惠环境不错这是第二次了下次还会来的,1
服务很好周六去了没排队上菜也挺快还不错,1
味道很好环境棒棒哒很文艺的感觉服务员态度也很不错团购元抢的超划算,1
牛排味道一般其他都还挺不错去了几次了,1
冰橘茶太冷换了热的柠檬茶很不错服务也很好两个人吃的很撑,1
环境不错煲的口味不叫辣适合我的口味水果也新鲜饮品也很好喝,1
环境不错服务很好下次去武汉还会到秀玉,1
一直感觉不错了吃了很多吃基本每个星期都要去吃,1
人很多需要等很久套餐内的东西还不错,1
牛扒还蛮嫩的最喜欢水果沙拉了超好个人不喜欢披萨服务还阔以哒环境有点暗我看不见啦嚯嚯感觉自己萌萌哒,1
味道不错厚多士很好吃牛排也不错,1
还可以就是牛排没以前好吃了有点老了,1
一如既往,1
牛排点的是九分熟的一个上了全熟一个七分熟虽然忙吧但是还是不要搞错了但是口味还不错就是上菜有点慢冰橘茶还是非常好喝的,1
分量很足味道很好环境也很好基本上每个月都要去吃一次每次有朋友来武汉玩也会带她们去吃这个两个人吃每次都吃不完服务也是最好的,1
这次点的菠萝虾仁炒饭和木瓜觉得炒饭不错,1
价格很划算,1
这个套餐可以吃的很饱环境不错划算,1
还可以一直都那样,1
价格非常实惠环境非常舒适服务非常周到,1
周末如果是情侣约会相亲就不要去了人超多电梯上不去爬楼梯上去的价格很便宜但是为了吃餐饭还是太折腾了,1
一看见这个团购又出来了就团了和朋友一起去的味道还不错服务非常好特别是服务员还会帮我们催菜吃的很饱下次有机会还会去的,1
消费全满意给足满分服务食物都很到位,1
慢慢慢东西吃完了才上水催了无数次,0
还可以人太多了都吃完了茶沙拉都没有上来,1
老顾客了经常去只能说就是好,1
牛排一个味服务态度很差餐具不干净还一副不耐烦的样子反正再也不想去了,1
服务很好东西很多味道也不错两个人吃的撑死了唯一不好的是离厨房太近了一眼就可以看到,1
菜还是一如既往的味道不过也许是饭点服务员很难看见然后信号好差,1
味道挺不错就是牛蛙感觉没以前肉多了都是骨头冰桔茶全是冰太多了其他都挺好希望东西能像以前一样做的真,1
很好环境很好味道也不错值得一去,1
