Comment,IsGreet
光谷步行街服务态度好虽难人多有点失误但能马上解决秀玉精选牛排好吃南瓜汤好喝披萨不错总之满意值得推荐希望活动多些就这样吧,1
西班牙风情街这家真的是人多啊等的急人但是很划算的,1
味道环境都不错如果折扣力度能够再大点就好了,1
还不错味道也可以挺划算还不错味道也可以挺划算,1
很好很划算环境比较舒适经常和朋友过来,1
味道很好服务分量都足就是要等餐,1
分量很足味道还不错喜欢披萨和茶饮,1
光谷二期环境非常好场子大味道也不错就是周末人多需要排队,1
人太多其他都还好就是服务还是不到位点完单就不管了水都没有,1
东西味道不错环境很好服务质量挺好的团购的很划算,1
喜欢秀玉的环境安静舒适服务态度也很好团购很划算这里的东西好吃又便宜,1
订的套餐品种蛮多主餐味道还可以吧不是我喜欢的喝的味道非常好,1
每次去必点黑胡椒牛肉炒意粉推荐,1
好吃环境也不错没想到星期二人也超级多用美团很划算便宜了五十块钱,1
服务态度好味道也不错每次去吃都是用的团购券值得推荐泰皇炒饭,1
不是特别满意服务不是特别到位,1
人太多啦服务员忙不过来其他还不错,1
生意很好要等很长时间特别是大座希望改进下,1
还不错两个人吃得很饱下次还回来,1
和同学一起去的很不错服务态度很好,1
还比较喜欢秀玉味道不错就是有点儿小贵也没有其他茶馆那样安静的环境,1
爽歪歪只是哪家店生意不好这个团购才有,1
人好多服务员都找不到了还有些拥挤味道还可以,1
很不错服务员挺热情的以后常来继续保持,1
菜品还算比较全经常吃秀玉棒棒哒,1
每次来光谷都会来二期店来地方大也宽敞人也不会太多服务态度也很好每次都很满意的走一百个赞赞赞啊,1
不错不错人好多有点嘈杂本来是挺浪漫和谐的环境安静点就好了,1
味道很好也很便宜就是菜有点油,1
超级划算环境也很好已经去了很多次了值得推荐,1
真心觉得这个饭店的菜味道还不错啊环境也还好服务也还不错就是人有点多等半天,1
味道还行就是人太多沙拉和冰欺凌很好吃意面有点油腻,1
满意喜欢吃那个厚多士好吃就是套餐里面的分量本身也很多了两个人吃的很饱,1
一般等了一会现在服务态度没之前好元宵节去的想吃的牛蛙煲仔饭和披萨都没有不开心,1
还不错星期六晚上人有点多排队半个小时左右就是一直想吃焗饭但是做的时间太长了,1
价位不错套餐特别实惠人均也才几十块钱环境不错,1
点了份牛排和蜂蜜厚多士牛排我一直都觉得很难吃这次也不例外但是室友很喜欢,1
还行吧环境挺好的菜的味道不敢恭维毕竟不是主打中餐可以理解,1
多做活动也可以改一下做活动的品种会更好,1
厚多士的味道和口感很棒冰橘茶少加些冰块会更好喝一些,1
感觉不错还可以吧就是慢了点,1
服务态度很好只不过人多了点还是很不错的值得,1
好很好非常好秀玉紅茶坊最好,1
晚上服务员赶时间着急下班服务态度一般,1
一起五个人吃的东西还不错就是服务不是特别好桌子太小咯,1
挺好的服务好口味合适环境可以两个人团了张券吃得好撑下次还会再来的,1
我的牛排都已经吃完了另外一份煲仔饭还没有来特别慢其他的还可以,1
服务态度很好下次还愿意去消费,1
味道不错吃过几次了服务很好,1
环境不错就是男卫生间设计不好有一个对着门好尴尬,1
经常光顾了喜欢吃她家的煲仔饭和绵绵冰,1
两个人吃的太撑了不过意粉真的很难吃黑椒也挺少的领班姐姐问我为什么一点都没吃还说重新做一份我弱弱的说了句吃饱了服务态度还是挺好的热的金桔柠檬的室友觉得挺好喝的就是太烫了就把它拿下来了蜡烛还是挺有情调的我觉得味道太浓了还是喝水比较好,1
还好披萨好难吃服务员好搞笑,1
上餐的服务员态度不好其他都的,1
非常满意的一次团购体验菜很多味道依然不错不过份量有点多三个女生都够吃,1
不错不错的味道很正地理位置很微妙,1
服务不错环境可以还会再去的,1
服务热情周到吧员服务很周到贴心,1
一如既往的好吃啊牛排很棒每次去披萨都吃不完,1
味道还可以虾子做的不行有待改进,1
经常吃一如既往的好吃,1
不错大家都觉得好性价比挺高有地方休息一下也好,1
好好吃啊好好吃现在还在吃这就不多说了,1
环境服务都蛮好就是人有点多总的来说挺划算的披萨也很好吃,1
一个人来吃的适合女孩子吃饭的地方,1
品种很多很丰富吃得很爽很划算就是环境太昏暗太闷了热的狠,1
东西很不错就是人多了点去了还要排队,1
今天是吃的最便宜的一回印尼炒饭比较慢就是,1
很好很划算牛排真的很好吃,1
人暴多嘈杂不像是西餐厅的感觉而是快餐厅的氛围,1
环境很好毕竟老店子了么东西还是那个味道主要是很划算,1
不错啦每天上消费下来省了不少牛排好贵啊,1
菜口味比较适合我中西结合环境不错,1
还行人太多吃饭等太久服务不够,1
菜品种类比较丰富口味也不错西班牙风情街的店人比较少环境更佳,1
菜品种类比较丰富口味也不错西班牙风情街的店人比较少环境更佳,1
团过很多次秀玉了环境不错服务也好东西味道也可以挺划算的,1
味道不错非常喜欢还会再来团购比较实惠,1
很不错黑椒牛排加黑椒牛柳意面还剩一块很实惠,1
服务好好但是不是很喜欢吃总体感觉还是不错的,1
吃的好撑不错不错味道很好服务也很好棒棒哒,1
很棒的一家餐厅环境不错服务很好餐饮也很棒价格也很实惠,1
口味不错和朋友吃的比较满意,1
运气不错一去就排到位置了人多服务员很忙点菜等了半天上菜也比较久但是很划算,1
环境优雅消费不高口味也还不错值得再次光顾,1
周六一点多去的人超多点的粥本来有个鸡蛋的厨师太忙都没上不过其他还可以,1
经常去环境还可以煲仔也可以牛排也可以,1
已经是第二次去了真的蛮好的下次还去,1
总体还不错除了上菜速度比较慢等了很久,1
环境不错上菜速度也还比较快服务员不太热情,1
前面团过一次还是货真价实的不会因为是团购而缩水两人餐完全够三人吃份量足质量好非常不错,1
人超级多还叫号排队了东西蛮好吃服务态度不错,1
服务态度很好东西也很好吃环境也相当不错,1
等的时间比较长环境还是不错的,1
好次真的亲测好次量足好次反正就是好次,1
这个双人餐很适合两个人去吃吃的也不错的下次还去,1
还不错俩个人都没有吃完就是店里太忙服务有点跟不上其他还好,1
星期六去的人太多了上菜都上了一个小时菜都上完了餐具还没上,1
等太久半个多小时才上人太多了味道还好,1
以前就吃过的自己很喜欢味道很棒环境也好喜欢但是位置不是很好找希望写的再清楚一些方便我们找到他的位置,1
好吃用代金券可以优惠一些以后可以多做这种活动,1
味道还行吧人很多以后还会去,1
和同学一起去的人挺多的但还可以吧,1
味道还可以就是分量有点少光吃炒饭一个人吃不饱环境很不错适合朋友聊天,1
等得太久了不爽一般等半小时,1
还不错哦特别是那个蜂蜜芝士面包配冰淇淋球超好吃用代金券和划算,1
环境与美食都不错这是我再次带了好伙伴们来滴大家还很满意吧有机会定会再来滴我吃饭时还不小心掉了张证件还是一位好心帅哥提心我呢十分感谢,1
口味还好冰橘茶不错人很多上菜速度很慢要等好久不过还是值得推荐的这个价格很划算,1
就那样吧人太多了服务自然就没那么感了,1
晚上去吃的人比较多但是排队也是蛮快的味道不错就价格来说很实惠总体不错有机会再去吃,1
感觉订团购上的牛排都不是新鲜的,1
实惠到不行两个人花了不到九十味道好,1
很不错出了很多新品意面也很好吃新出的冰淇淋蛋糕也不错,1
这个团购是第次来了吧觉得很划算每次都是两个人吃吃得好饱强烈推荐,1
全国各地都差不多没什么好说的为了拿积分,1
在光谷的西班牙风情街三楼吃的原本是打算在区吃结果那边不让用的团购咳咳来这里感觉更好座位很多一直到我们吃完都没有人排队服务员态度都很好来说一说吃的牛排单点也很划算七分熟刚刚好很赞牛蛙褒仔饭超级辣可能是因为我不太能吃辣的原因吧不过还配了一碗排骨汤好喝披萨很好吃芝士放的挺多水果沙拉摆盘很好看冰橘茶很赞我们还点了一分烤翅还不错最后两个人吃的都很饱总的来说是一次很满意的团购哎呀写了这么多应该可以算得上认真评价吧哈哈,1
非常喜欢秀玉的环境更喜欢秀玉的牛排煲仔饭,1
喜欢秀玉的服务和食物就是现在还需要排队,1
环境不错菜品可口服务到位上菜有点慢,1
嗯一直都还蛮喜欢这里感觉价格还可以,1
味道还行服务也可以但就是殿堂的油烟味太大,1
团购很划算味道也很好光谷只有光谷二期店才能用大家注意了我就冤枉跑了些路,1
真的好不错哦很好吃服务也好,1
吃了好几次味道挺好的环境也很好,1
味道可以环境也可以服务态度也还行甜品挺好的,1
味道可以环境也可以服务态度也还行甜品挺好的,1
环境和服务都很到位东西也很便宜几个人一起吃很划算下次吃饭会再来消费,1
点了葡式猪扒焗饭和香辣咖喱牛仔肉焗饭味道不错牛仔肉口感还蛮嫩的环境不错服务一级棒看我们拿的东西蛮多服务员特意帮我们找了个大点的位子服务员工作都蛮主动贴心赞一个,1
还可以活动更多就好,1
份量很足个人吃非常够味道不错超级划算的推荐,1
以前常来这是第一次用团购还不错,1
环境口味什么的超级赞服务很好态度很好下次还会去的牛排很好吃泡菜一般意面不错披萨好吃,1
挺好的服务口味都不错有机会还会再来的,1
吃的饱饱的价格适中而且味道不错,1
不错呀很好吃点的牛排环境不错很适合闲谈聊天份舒适,1
牛排的筋好多每次说要配饭都给我配的意面不开心,1
味道还行性价比高就餐环境好下次可以考虑再来,1
味道一如既往光谷店服务也很周到下次还会去,1
还是老样子天天吃煲仔饭也吃不烦就是少了点,1
吃着很美味都和朋友来了很多次了第一次是朋友介绍来的后来都是带着朋友来赞,1
很喜欢口感很好也可能是习惯了吧,1
很好吃过很多次了呵呵呵还会去的,1
还不错的环境挺好的是个和异性一起去,1
服务员很热情环境很好美中不足的是饮品不是很热温温的如果喜欢喝热的建议事先跟服务员说一下,1
服务态度太差了一份破薯条等了一个小时非常,1
感觉没有很划算味道一直都差不多没有难吃也没有好吃正常无法评价出什么特点来,1
很好很喜欢弟弟也超级爱吃这里的东西服务也很好,1
服务很好非常不错下次还回去,1
经常去吃呢老顾客了很实惠,1
光谷店上菜快食物也是热腾腾的团餐很实惠很好,1
还不错就是吃到最后有点凉了口味什么的还可以,1
味道还不错环境也挺好服务还不错,1
是我蛮喜欢的一个吃饭的地方环境好味道也还可以,1
生意太好服务跟不上但是菜比其他秀玉做的好,1
来了很多很多次了物美价廉超赞,1
去的时候木有等位吃完才发现好多人很喜欢他家的牛排和水果沙拉每次来都必点,1
感觉蛮好的服务员美女好热情,1
环境还不错态度还行就是上餐有点慢,1
太棒了两个人吃撑了,1
人很多周末去一般都要等的不过味道依旧很好,1
环境好味道不错个人一起用美团买价格要便宜好多,1
不错很好吃我们都吃光光了我们去滴时候人很多,1
服务挺好的价格也挺实惠的我点了一个黑胡椒牛柳意面和小肋牛排牛排要的分熟的冷盘但送来一吃考过了都不见红了一嚼都成渣了,1
点的秀玉招牌拉面真的味道很一般不怎么好吃,1
炒饭味道很好就是份量太少牛排味道不错就是薏面不好吃,1
生意太好每次都要等可能人太多东西做得没有之前好了,1
服务不错环境不错味道也不错值得推荐哦,1
煲仔饭真的好吃里面的茶也不错总之蛮好的红烧牛蛙煲仔,1
都还不错服务有点慢去的那次炸炉坏了其他的都还挺好的,1
分量很足味道不变冰橘茶超好喝棒棒哒,1
环境挺好价格实惠味道不错就是人好多,1
不错还是和以前一样湘西小炒肉煲仔饭好吃其他的都不咋地,1
相当的赞啦好吃又便宜环境好服务态度也是一流,1
环境很棒一直这样觉得服务也是一如既往的好就是口味再提升一点就好了,1
什么披萨真不好吃再说两个人吃真心吃不完把披萨去掉就好了,1
去的迟了服务员超级忙上菜极慢叫个人太慢又不是周末真是奇怪,1
菜品不错那个玉米汁很好喝不足的是有点吵,1
还不错第二次来了环境蛮好的就是今天上菜有点慢不知道是不是人多的缘故,1
服务蛮好东西也挺好吃的就是人太多了蛮难等,1
周末去滴人很多不过翻台子快木有等多久,1
好吃的地方比较经济实惠下次还会来的,1
环境不错口感很好服务体验不错,1
很好两个人撑死了下次继续味道很好茶很好喝牛排还是那么有较劲,1
一定难度大型活动筋骨吧唧韩国政府,1
好好一个借口更何况回家就感觉很好,1
只要吃饭第一个就想到秀玉服务很好菜色也不错值得和朋友一聚的好地方,1
一般般吧没特别好吃的就士多厚还可以千万别点黑椒牛排难吃,1
还不错来吃的人也很多有机会会再光顾的,1
都还不错的服务有点慢去的那次炸炉坏了其他的都还好,1
黑胡椒牛肉意面很好吃蔬菜也比较新鲜值得一去,1
十分不错经常来牛扒比以前要好吃了泰皇炒饭味道和以前一样好吃就是少了点下次肯定还来,1
其他的菜其实还可以菠萝虾不是蛮划算,1
钱包掉那里了自己跑去找到了,1
非常好就是光谷周末不接待其他的没区别,1
煲仔饭和披萨不错也蛮喜欢冰橘茶和酷酷虾的环境也不错下次再来,1
东西很好吃价格实惠牛排不错环境也好,1
还可以吧应该是性价别挺高得一家餐厅了,1
来了很多次了不错不错,1
环境不错味道也很好团的卷也很划算,1
味道相当不错环境很好很大的店不用等位,1
感觉是为数不多的质量仅存的秀玉中的一家了吧赞,1
和丫头本科所哦墨迹啦咯了如图,1
不错呦就是焗饭好慢啊朋友都把牛排吃完了醉了,1
去的时候人比较多等待时间太长味道还行,1
味道不错服务也还好那个德式牛扒吃货们千万不要点真心不好吃,1
正是吃饭的时间人比较多站等了一会没有位置坐不过还好一下就叫到我们了,1
煲仔饭和披萨不错也蛮喜欢冰橘茶和酷酷虾的环境也不错下次再来,1
味道服务都可以吃了很多吃下次还会去,1
经常吃的常常买这个券吃得蛮饱的,1
好吃不用多说便宜就不说了太多太多,1
一般希望有更多的菜品加油改进,1
一般希望有更多的菜品加油改进,1
量足四个人吃到撑店内人很多环境嘈杂没有西餐厅的安静优雅,1
味道还行可能是饭点服务员比较忙倒水买单都等了下,1
可以吧来了很多次每次都不错,1
环境很好人多可能忙不过来服务就有点呵呵,1
价格非常实惠味道很不错买了好多次了,1
很划算哦味道也很好两个人吃的饱饱的一个,1
好吃饭有点辣其余都还不错吃了很多次了,1
价格蛮便宜就是人太多了排了半天的队,1
总体还好就是去的时候人太多想吃的披萨没有了然后没吃饭推荐菜单因为光顾着看菜单了,1
我和麻麻二个人吃天阿撑死了过年刚开始我就瞬间增肥了,1
菜的味道不错环境也好就是生意太好要排队,1
来很多次了味道不错太皇炒饭份量变少了,1
非常划算披萨很好吃饮料也不错就是好难等,1
环境不错食物也不错价格也挺实惠的不错下次还来,1
味道不错环境好大牌子还是值得信赖的,1
来了很多次了刚好这两天做活动团的代金券很划算一起去吃好划算的说虽然人超多赞赞下次还来,1
都还不错环境啊啥的比较满意就是菜色有点少,1
超级划算吃的太好啦两个人吃其实有点撑光谷那家环境也很好服务态度也很好,1
环境一般厕所很脏奇葩不好吃焗饭很失败咖啡太苦服务还,1
人多服务员太少点餐需要等让加个黑椒汁说了多次等了久都没有上醉了,1
分量不错不过意粉味道不咋地,1
味道还不错就是上菜速度太慢了等了太久,1
人好多黑我等了大半个小时终于等到了一顿狼吞虎咽哈哈,1
秀玉的东西很好吃份量也很不错水果沙拉很给力不像有些地方都是西瓜,1
还不错去了好多次了寸的披萨好小,1
和女朋友去的排队拍了一会儿很幸福很开心希望能有其他人祝福,1
周末去的人很多不过翻台子很快木有等多久,1
味道一直都还可以价格也算比较划算去过好多次了,1
服务态度挺好的价钱也不是很贵环境也不错,1
人多了点音乐的声音放得太大菜的味道很好,1
味道不错服务也不错价格也不贵环境也错值得一试,1
和朋友一起来的都挺喜欢就是等待时间有些久,1
不错团购很划算比会员卡划算不过要是可以累积消费更好了,1
喜欢冷盘的牛排团购很划算哦,1
工作餐聚集地最近一直有持续优惠继续保持喔,1
不错环境什么的团购也没有被嫌弃服务生态度挺好的,1
环境不错人太多有点拥挤服务态度不太好菜品不多,1
团了两张票一如既往的好吃还多了块钱没用送给店家了,1
非常满意吃的好饱服务也棒棒的,1
味道很好环境很好就是去晚了要等位置,1
难得糊涂看到歌手姚贝娜还是舅爷爷病逝得消息莫名得很伤感人生都是短短几十年但大家都在努力得活着与相亲相爱的亲人们谱写着生活点点滴滴有争吵有怨恨有放不下得情节有快乐的回忆不管哪种相识都是某种不合理得缘分开始因为最终没能如愿走在一起奈何青春离我们越来越远但永远不能为你后悔的青春买单,1
不错就是晚上高峰期要排队人好多上菜有点慢,1
很满意已经来吃了两次了吃的很撑啊,1
消费者太多服务员太少服务质量有待提高,1
真的很不错好划算以后还会来的哟,1
总体来说还是很不错就是去的时候中午有个菜等了半个小时才上,1
还可以味道还不错有的时候人太多了,1
很不错呀味道好环境也挺好服务好像比以前更加好了很棒加油以后还会来的多做点活动就更加好了,1
消费者太多服务员太少服务质量有待提高,1
已经是老店了服务是一如既往的好只是感觉菜品的味道现在比不上以前了希望多加改善,1
很好很喜欢很满意下次还会去的,1
额地方好找环境不错经常去,1
周五晚上去的人好多上菜特别慢我都吃完了老公的牛排还没有上都吃完一会了披萨才上老公说披萨很好吃可惜我们都已经饱了也没有服务员来加水之前去还好这次就是人多有点吵,1
吃过很多次了性价比还可以味道也不错,1
位置很好找就在步行街三楼上环境优雅很不错团购很划算和男票两个人吃都吃的很撑牛排鲜嫩披萨很厚实牛蛙饭辣香金桔柠檬茶很热喝了很暖和沙拉也很好吃有吃有喝牛排米饭齐全美团验证后也很快推荐,1
一如既往的好吃几乎每个星期都会去希望以后还是优惠多多好喜欢牛扒还有沙拉,1
味道还不错服务态度很好下次还会再来,1
还不错经常吃的一家店不过西班牙风情街的千层面和其他家有点不一样不好吃,1
好吃规划巨化股份骨灰盒广钢股份,1
一如既往的好下次还会再来消费的,1
一如既往的好下次还会再来消费的,1
经常去的很好离家近味道不错,1
味道一般但是分量还是挺足的也便宜总体上还不错啦,1
焗饭看起来还不错不过吃起来不够理想牛块比较大其它满意,1
鸡中太腻了第一次饭没吃完就想拉肚子,1
真心不错二人餐吃得很饱下次还会再去的,1
两个人吃的环境很好服务也周到吃的也不错都很好,1
特别的好吃分量也很足两个人吃足够多了,1
一如既往的好下次还会再来消费的,1
服务很好东西很不错环境也很好服务很好东西很不错环境也很好,1
一如既往的好吃去过好多次了,1
餐厅的环境菜品都不错周末人有点多感觉服务较平时差了点,1
就那样吧人太多感觉在过马路,1
一直光顾很喜欢蒜香鸡中节和走地鸡汤拉面味道清淡汤味浓郁好评蒜香鸡中节夏天茶,1
味道不错环境也可以就是手机信号到里面就没有了网速也不行,1
味道很棒价格也比较实惠总的来说还是蛮不错的,1
不错环境很好吃的很饱两个人吃不完,1
还行吧价格还挺实惠的之前喜欢这个套餐现在用代金券用的多,1
环境特别好菜也不错第二次吃了还会再来,1
去吃的午饭还不错还不错,1
还可以最喜欢黑胡椒意粉和奶茶,1
东西还可以环境也可以就是可能是星期五人特别多上菜特别慢,1
一如既往的好吃了很多遍了茶水很好喝以后还会去的,1
人太多了等了太久位置还可以味道一般般,1
什么都很好就是可供选择的太少了希望菜品同样价钱的可以互调,1
人太多了啊服务也很不即时呢甜品等了个小时,1
服务态度很好就是去的好多人等了好久,1
人多顾不过来披萨和牛排微腻炒饭好干,1
感觉越来越不好吃服务一般呼叫器按半天也没人理,1
昨天和男朋友一起过去的还是推荐披萨当然热茶和水果沙拉超美味哦两个人真是吃不完其实可以改改套餐内容,1
蛮好的都团了好几次了特别是我家宝贝很喜欢吃水果披萨一家三口再加一份虾饼就很好了,1
一样的好吃不过周末人真的好多到处都很多,1
来了好多次了味道很好速度也快,1
非常好吃非常好吃非常好吃,0
还不错环境也不错味道也挺好的,0
这次去的光谷西班牙风情街店感觉还不错但是服务呢真心觉得越来越差了吃过秀玉的好几家店这家全是好的可是也没我第一次来这里吃感觉服务好了呢点了个没吃过的牛扒还有最爱的厚多士食物很满意,1
一壶茶等了一个小时啊从吃饭等到吃完还没来,1
味道非常不错环境也蛮好的是那种暖色调的感觉,1
来了很多次了东西真不错还会再来的哦,1
吃了几次了感觉还可以吧可能是人太多了上菜稍微慢了点,1
点的披萨每次去他家都点锅巴饭非常好吃牛排也不错价格也实惠以后会经常去的,1
刚拆阿拉搜亏某镂空回馈女模来咯哦呢哦漏咯哦陌路,1
服务好环境稍微有点嘈杂味道不错,1
好难找到地方菜品好辣啊不是很满意,1
很不错啦味道很赞,1
好很好非常好就是人多了排队好久上菜等好久,1
人太多了但是两人套餐很划算吃不完撑到不行喜欢吃以后得错开吃饭高峰期去才行,1
团购还是蛮实惠的希望多搞一些促销活动,1
感觉不太好上菜太慢太慢要的披萨也没有,1
好吃环境好分量足第二次来了下次还会再来,1
还可以上菜太慢估计是双休的原因,1
口味很好但是服务员有点慢哦叫了许久都没有人过来帮忙点单,1
好不错多出新品嘛,1
秀玉吃了很多家味道一直不错这家是吃过最大的秀玉店了人多的时候店里有点忙不过来生意挺好的哦,1
点菜服务员把菜点掉了等了分钟一直没上菜才知道服务员点掉了等了好久,0
每次去人都好多去光谷二期上楼堵了好久,1
秀玉还是一如既往的那么好很划算呀,1
味道不错环境不错位置好找消费不高总体不错,1
难吃死了环境极差吵那个什么意面披萨也是够了水果沙拉也是牛排硬的要死,0
可以环境不错速度慢了点,1
来秀玉几次了挺好的和朋友聚会的好去处,1
每次都团的你们家的卷哟很好吃尤其是煲仔饭我特别喜欢吃下次还会来的哟,1
吃多了但是味道很棒基本上一人差不多吃饱,1
牛排和披萨都很棒就是上菜速度有点慢,1
人很多但是叫号很快牛肉朋友帮忙点的分熟有点吃不下,1
还不错团购比较合算两个人两张卷正好,1
团的二人餐份量很足味道也不错服务一流环境也十分舒适值得下次再光顾,1
先用的团购后又用代金券服务周到菜品更没话说好评是必须的,1
秀玉还是一样的赞没得说休闲逛街必来,1
这次去秀玉人很多等的时间很长焗饭感觉没熟不好吃印象很不好,1
好吃二个人吃不完那个柚子茶很好喝就是不能打包遗憾人太多了还等了十几分钟,1
还可以味道也不错环境也还好,1
还行就是人多时上菜慢服务员难找,1
煲仔饭味道还可以其他意面不行,1
不好吃不会再来了人多服务跟不上,1
还可以吧环境不咋的有点旧了,1
